Name,Country,Role,Organization,Type,Category,Contribution,ImageUrl,WebsiteUrl,LinkedinUrl,KeyResourceUrl
David Hook,Australia,"VP Software Engineering; Founder",Legion of the Bouncy Castle,Private,Industry Vendor,"Co-founded the Legion of the Bouncy Castle in 2000 — one of the most widely used open-source cryptographic API libraries in Java and C# — which integrated full NIST PQC standard support (ML-KEM, ML-DSA, SLH-DSA) through 2024. He led the FIPS 140-2/3 certifications of Bouncy Castle's Java and C# APIs and presents extensively on hybrid PQC techniques, stateless PQC digital signatures, and Key Encapsulation Mechanisms. His work makes enterprise-grade PQC accessible to millions of developers globally.",https://ui-avatars.com/api/?name=David+Hook&background=0b0d17&color=a78bfa&size=128&bold=true,https://www.bouncycastle.org/,https://www.linkedin.com/in/david-hook-29b720/,draft-bonnell-lamps-chameleon-certs-07
Corey Bonnell,USA,Technology Strategist,DigiCert,Private,Standards,"Active co-author in the IETF LAMPS Working Group and originator of the Chameleon Certificates Internet-Draft (draft-bonnell-lamps-chameleon-certs), which enables paired classical/PQC certificate structures for phased quantum migration. He co-authored the IETF PQC for Engineers guidance document and contributes to standardizing how ML-DSA, SLH-DSA, and composite algorithms are encoded in X.509 certificates. He represents DigiCert in CA/Browser Forum, X9, and IETF standards bodies.",https://ui-avatars.com/api/?name=Corey+Bonnell&background=0b0d17&color=60a5fa&size=128&bold=true,https://www.digicert.com/,https://www.linkedin.com/in/coreybonnell/,draft-bonnell-lamps-chameleon-certs-07
John Gray,Canada,Software Developer (Architect),Entrust,Private,Standards,"Lead co-author of the IETF LAMPS Composite ML-DSA and Composite ML-KEM Internet-Drafts, which define how hybrid classical+PQC algorithms are encoded in X.509 certificates and CMS structures. His composite certificate standards work — together with Mike Ounsworth at Entrust — was adopted into the IETF standards track and represents the primary industry path for backward-compatible PQC certificate migration. He has published 3 RFCs and maintains 9+ active Internet-Drafts across LAMPS and related working groups.",https://ui-avatars.com/api/?name=John+Gray&background=0b0d17&color=60a5fa&size=128&bold=true,https://www.entrust.com/,https://www.linkedin.com/in/john-gray-aa281460/,draft-bonnell-lamps-chameleon-certs-07
Sudha E. Iyer,Ireland,Chief Cybersecurity Architect (Digital Assets and Data),Citi,Private,Industry Adopter,"Founding member of the FS-ISAC Post-Quantum Cryptography Working Group, representing the financial sector's largest global coordination effort on quantum migration readiness. As Chief Cybersecurity Architect at Citi with over 20 years of cryptographic architecture experience, she leads enterprise-scale PQC adoption strategy at one of the world's largest financial institutions. She also serves as International Project Leader at ISO for smart contract and blockchain security standardization, and speaks internationally on PQC readiness in regulated industries.",https://ui-avatars.com/api/?name=Sudha+Iyer&background=0b0d17&color=10b981&size=128&bold=true,https://www.fsisac.com/knowledge/pqc,https://www.linkedin.com/in/sudhaeiyer/,
Tadahiko Ito,Japan,Senior Researcher,SECOM CO. LTD.,Private,Standards,"Senior Researcher at SECOM specializing in cryptographic key management, PQC migration planning, and policy standardization, with IETF contributions including RFC 9336 (X.509 Extended Key Usage for document signing). He contributes to IETF PQC certificate migration guidance and the IETF Hackathon's pqc-certificates interoperability project, and co-authored a 2025 academic paper on the grand challenges of PQC blockchain migration. He is a regular speaker at international forums including the PKI Consortium PQC Conference and FS-ISAC APAC Summit.",https://ui-avatars.com/api/?name=Tadahiko+Ito&background=0b0d17&color=60a5fa&size=128&bold=true,https://www.secom.co.jp/english/,https://www.linkedin.com/in/tadahiko-ito-b1b674160/,
Tomofumi Okubo,USA,"Software Engineer; Standards Contributor",DigiCert,Private,Standards,"Co-author of Chameleon Certificates IETF Internet-Draft (draft-bonnell-lamps-chameleon-certs) and active contributor to IETF LAMPS Working Group hybrid PKI specifications; represents DigiCert in standardization of PQC X.509 certificate formats and encoding.",https://ui-avatars.com/api/?name=Tomofumi+Okubo&background=0b0d17&color=60a5fa&size=128&bold=true,https://www.digicert.com/,,draft-bonnell-lamps-chameleon-certs-07
Dr. Marco Piani,Canada,Senior Research Analyst,evolutionQ Inc.,Private,Standards,"Co-author with Michele Mosca of the annual Global Risk Institute Quantum Threat Timeline reports (2024, 2025); provides quantitative probabilistic assessments of cryptographically relevant quantum computer (CRQC) timelines used by policymakers and enterprises worldwide.",https://ui-avatars.com/api/?name=Marco+Piani&background=0b0d17&color=60a5fa&size=128&bold=true,https://evolutionq.com/,,"GRI-Quantum-Threat-Timeline-2024;GRI-Quantum-Threat-Timeline-2025"
Alison Becker,USA,Cryptographer,National Security Agency (NSA),Public,Government,"NSA cryptographer and co-author of RFC 9763, specifying algorithm identifiers for ML-KEM, ML-DSA, and SLH-DSA for use with the Commercial National Security Algorithm Suite 2.0 (CNSA 2.0); contributes to NSA public guidance on quantum-safe cryptography.",https://ui-avatars.com/api/?name=Alison+Becker&background=0b0d17&color=22d3ee&size=128&bold=true,https://www.nsa.gov/,,RFC-9763
Michael Jenkins,USA,"Technical Director; Cryptographer",National Security Agency (NSA),Public,Government,"NSA Technical Director and co-author of RFC 9763 defining algorithm identifiers for post-quantum algorithms in CNSA 2.0; contributor to NSA public guidance on quantum-safe cryptography transitions for national security systems.",https://ui-avatars.com/api/?name=Michael+Jenkins&background=0b0d17&color=22d3ee&size=128&bold=true,https://www.nsa.gov/,,RFC-9763
Rebecca Guthrie,USA,Cryptographer,National Security Agency (NSA),Public,Government,"NSA cryptographer and co-author of RFC 9763, establishing the algorithm identifiers for ML-KEM, ML-DSA, and SLH-DSA used in federal CNSA 2.0 implementations; contributes to standards underpinning U.S. national security PQC migration.",https://ui-avatars.com/api/?name=Rebecca+Guthrie&background=0b0d17&color=22d3ee&size=128&bold=true,https://www.nsa.gov/,,RFC-9763
Allen Roginsky,USA,Research Scientist,NIST,Public,Government,"NIST Computer Security Division researcher and co-author of NIST SP 800-131A Revision 3, providing guidance on transitioning cryptographic key lengths and algorithms to post-quantum standards across U.S. federal systems.",https://ui-avatars.com/api/?name=Allen+Roginsky&background=0b0d17&color=22d3ee&size=128&bold=true,https://csrc.nist.gov/,,NIST-SP-800-131A-Rev3
Elaine Barker,USA,Research Scientist,NIST,Public,Government,"NIST researcher and co-author of NIST SP 800-131A Revision 3, guiding federal agencies on transitioning cryptographic key lengths and algorithms to post-quantum standards; long-time contributor to NIST SP 800-57 key management recommendations.",https://ui-avatars.com/api/?name=Elaine+Barker&background=0b0d17&color=22d3ee&size=128&bold=true,https://csrc.nist.gov/,,NIST-SP-800-131A-Rev3
Suzanne Lightman,USA,"Research Scientist; Project Lead",NIST NCCoE,Public,Government,"NIST NCCoE project lead and co-author of NIST SP 800-82 Revision 3 (Guide to Operational Technology Security); key contributor to guidance on OT/ICS PQC migration for critical infrastructure sectors including energy, manufacturing, and transportation.",https://ui-avatars.com/api/?name=Suzanne+Lightman&background=0b0d17&color=22d3ee&size=128&bold=true,https://www.nccoe.nist.gov/,,NIST SP 800-82 Rev. 3
Michael Thompson,USA,"Lead Engineer; OT Security Expert",MITRE,Private,Standards,"MITRE engineer and co-author of NIST SP 800-82 Revision 3, providing authoritative guidance on cybersecurity for operational technology (OT) environments; his work informs PQC migration planning for industrial control systems and critical infrastructure.",https://ui-avatars.com/api/?name=Michael+Thompson&background=0b0d17&color=60a5fa&size=128&bold=true,https://www.mitre.org/,,NIST SP 800-82 Rev. 3
Eric Rescorla,USA,Chief Technology Officer,Mozilla,Private,Standards,"Chief Technology Officer at Mozilla; primary editor of TLS 1.3 (RFC 8446) and DTLS 1.3 (RFC 9147); one of the most influential contributors to modern web security protocols whose standards are the primary migration targets for quantum-safe TLS deployment.",https://ui-avatars.com/api/?name=Eric+Rescorla&background=0b0d17&color=60a5fa&size=128&bold=true,https://mozilla.org/,,"RFC 8446;RFC 9147"
David Benjamin,USA,"Senior Software Engineer; Standards Contributor",Google,Private,Standards,"Google software engineer and co-author of the IETF Merkle Tree Certificates Internet-Draft, developing post-quantum optimized certificate compression for TLS that dramatically reduces handshake sizes while enabling PQC algorithms; active contributor to TLS and BoringSSL.",https://ui-avatars.com/api/?name=David+Benjamin&background=0b0d17&color=60a5fa&size=128&bold=true,https://www.google.com/,,draft-ietf-plants-merkle-tree-certs
Jake Massimo,USA,"Applied Scientist; Cryptography Researcher",Amazon Web Services,Private,Standards,"AWS cryptography researcher and co-author of RFC 9909 (Post-Quantum Traditional Hybrid Key Encapsulation Methods), defining standards for combining classical and PQC key exchange mechanisms in a secure hybrid construction adopted in TLS and IKEv2.",https://ui-avatars.com/api/?name=Jake+Massimo&background=0b0d17&color=60a5fa&size=128&bold=true,https://aws.amazon.com/,,RFC-9909
Jim Schaad,USA,Security Standards Contributor,August Cellars,Private,Standards,"Prolific IETF security standards author who edited COSE (RFC 9052), CBOR security formats, and S/MIME cryptographic message standards; his foundational work enables PQC algorithm integration in constrained IoT environments. Passed away August 2021.",https://ui-avatars.com/api/?name=Jim+Schaad&background=0b0d17&color=60a5fa&size=128&bold=true,,,RFC 9052
Karen Seo,USA,Network Security Engineer,BBN Technologies,Private,Standards,"Co-author of RFC 4301 (Security Architecture for IP / IPsec), the foundational standard for IPsec that forms the basis for quantum-safe VPN migration planning under CNSA 2.0 and NIST guidance across government and enterprise environments.",https://ui-avatars.com/api/?name=Karen+Seo&background=0b0d17&color=60a5fa&size=128&bold=true,,,RFC 4301
Stephen Kent,USA,"Chief Scientist, Information Security",BBN Technologies,Private,Standards,"Author of RFC 4303 (IP Encapsulating Security Payload) and RFC 4301 (IPsec Architecture), foundational VPN security standards that are primary migration targets in quantum-safe transition programs; former IETF Security Area Director.",https://ui-avatars.com/api/?name=Stephen+Kent&background=0b0d17&color=60a5fa&size=128&bold=true,,,"RFC 4303;RFC 4301"
Pieter Wuille,Belgium/USA,"Bitcoin Core Developer; Co-Founder","Bitcoin Core;Chaincode Labs",Private,Algorithm Inventor,"Author of BIP-32 (Hierarchical Deterministic Wallets) and BIP-141 (Segregated Witness), foundational Bitcoin cryptographic standards; co-author of BIP-340 Schnorr signatures; co-founder of Chaincode Labs; his protocol designs are primary targets for digital asset PQC migration.",https://ui-avatars.com/api/?name=Pieter+Wuille&background=0b0d17&color=f59e0b&size=128&bold=true,https://chaincode.com/,,"BIP-32;BIP-141"
Tim Ruffing,Germany,"Research Scientist; Cryptographer",Blockstream,Private,Algorithm Inventor,"Author of BIP-340 (Schnorr Signatures for Bitcoin), enabling efficient signature aggregation; researcher at Blockstream; co-author of MuSig2 threshold signatures; his signature schemes are central to digital asset cryptographic infrastructure requiring PQC migration.",https://ui-avatars.com/api/?name=Tim+Ruffing&background=0b0d17&color=f59e0b&size=128&bold=true,https://blockstream.com/,,BIP-340
Anthony Towns,Australia,"Bitcoin Core Developer; Researcher",Bitcoin Core,Private,Standards,"Author of BIP-341 (Taproot), upgrading Bitcoin smart contracts with Schnorr signatures and Merkle trees; independent Bitcoin Core developer whose protocol upgrades are relevant to PQC migration planning for digital asset ecosystems.",https://ui-avatars.com/api/?name=Anthony+Towns&background=0b0d17&color=60a5fa&size=128&bold=true,,,BIP-341
Gavin Wood,UK,"Co-Founder; CTO","Ethereum Foundation;Parity Technologies",Private,Industry Vendor,"Co-founder of Ethereum and author of the Ethereum Yellow Paper defining the EVM protocol; founder of Parity Technologies and Polkadot/Web3 Foundation; his foundational blockchain architecture designs are central to PQC migration strategies for decentralized infrastructure.",https://ui-avatars.com/api/?name=Gavin+Wood&background=0b0d17&color=a78bfa&size=128&bold=true,https://ethereum.org/,,Ethereum-Yellow-Paper
Brian Campbell,USA,"Senior Technical Architect; OAuth Expert",Ping Identity,Private,Standards,"Co-author of SD-JWT Verifiable Credentials (RFC-9901) and DPoP (RFC 9449); prolific IETF OAuth working group contributor; his digital identity and access token standards require PQC-safe signature migration across enterprise SSO and identity infrastructure.",https://ui-avatars.com/api/?name=Brian+Campbell&background=0b0d17&color=60a5fa&size=128&bold=true,https://www.pingidentity.com/,,"RFC-9901-SD-JWT-VC;RFC 9449"
Daniel Fett,Germany,"Security Researcher; OAuth Expert",Authlete,Private,Standards,"Co-author of SD-JWT Verifiable Credentials (RFC-9901) and DPoP (RFC 9449); active IETF OAuth working group contributor; his digital identity standards form the basis for quantum-safe verifiable credential and access token systems in the EU and globally.",https://ui-avatars.com/api/?name=Daniel+Fett&background=0b0d17&color=60a5fa&size=128&bold=true,https://authlete.com/,,"RFC-9901-SD-JWT-VC;RFC 9449"
John Bradley,Canada,"Senior Technical Architect; Identity Standards Expert",Yubico,Private,Standards,"Co-author of DPoP (RFC 9449) and JSON Web Token (RFC 7519); active in OpenID Foundation and IETF OAuth working group; his identity token standards are critical quantum migration targets for enterprise single sign-on and API security.",https://ui-avatars.com/api/?name=John+Bradley&background=0b0d17&color=60a5fa&size=128&bold=true,https://www.yubico.com/,,"RFC 9449;RFC 7519"
Kristina Yasuda,Japan/USA,Senior Identity Standards Engineer,Microsoft,Private,Standards,"Co-author of SD-JWT Verifiable Credentials (RFC-9901) and active contributor to W3C Verifiable Credentials Data Model; contributes to quantum-safe digital identity infrastructure at Microsoft and IETF decentralized identity standards.",https://ui-avatars.com/api/?name=Kristina+Yasuda&background=0b0d17&color=60a5fa&size=128&bold=true,https://www.microsoft.com/,,RFC-9901-SD-JWT-VC
Mark D. Baushke,USA,Network Security Engineer,Juniper Networks,Private,Standards,"Author of RFC 8731 (Use of Curve25519 and Curve448 in SSH), establishing the baseline elliptic curve cryptography in SSH that is central to the PQC-SSH migration path; active in IETF CURDLE working group for cryptographic algorithm updates.",https://ui-avatars.com/api/?name=Mark+D+Baushke&background=0b0d17&color=60a5fa&size=128&bold=true,https://www.juniper.net/,,IETF RFC 8731
Paul Bastian,Germany,"Security Engineer; Standards Contributor",Bundesdruckerei (BDR),Private,Standards,"Co-author of the IETF Token Status List draft, defining scalable mechanisms for verifiable credential revocation in digital identity systems; employee of Bundesdruckerei (German federal security printing), driving quantum-safe government digital identity infrastructure.",https://ui-avatars.com/api/?name=Paul+Bastian&background=0b0d17&color=60a5fa&size=128&bold=true,https://www.bundesdruckerei.de/,,IETF-Token-Status-List
Tobias Looker,New Zealand,Principal Cryptography Engineer,MATTR,Private,Standards,"Co-author of the IETF Token Status List draft; principal cryptography engineer at MATTR; expert in W3C Verifiable Credentials, DIF decentralized identity, and OpenID Connect for Verifiable Presentations; driving quantum-safe digital credential infrastructure.",https://ui-avatars.com/api/?name=Tobias+Looker&background=0b0d17&color=60a5fa&size=128&bold=true,https://mattr.global/,,IETF-Token-Status-List
Emilia Kasper,Netherlands/USA,"Software Engineer; Security Researcher",Google,Private,Standards,"Co-author of RFC 6962 (Certificate Transparency), the foundational PKI audit log mechanism being extended for PQC certificate monitoring; OpenSSL contributor; worked on early PQC experiments in Chrome alongside the Cloudflare team.",https://ui-avatars.com/api/?name=Emilia+Kasper&background=0b0d17&color=60a5fa&size=128&bold=true,https://www.google.com/,,RFC 6962
Chris M. Lonvick,USA,"Network Security Engineer; RFC Editor",Cisco Systems,Private,Standards,"Co-editor of SSH Architecture (RFC 4251) and SSH Transport Layer Protocol (RFC 4253), the foundational standards for SSH whose algorithms are primary targets in quantum-safe migration plans worldwide.",https://ui-avatars.com/api/?name=Chris+M+Lonvick&background=0b0d17&color=60a5fa&size=128&bold=true,https://www.cisco.com/,,"RFC 4251;IETF RFC 4253"
Tatu Ylonen,Finland,"Inventor of SSH; CEO",SSH Communications Security,Private,Algorithm Inventor,"Inventor of the Secure Shell (SSH) protocol (1995); co-editor of SSH RFC standards (RFC 4251–4253); founder of SSH Communications Security; his protocol is one of the primary migration targets in quantum-safe transition programs globally, protecting billions of server connections.",https://ui-avatars.com/api/?name=Tatu+Ylonen&background=0b0d17&color=f59e0b&size=128&bold=true,https://www.ssh.com/,,"IETF RFC 4253;RFC 4251"
Ben Laurie,UK,Security Researcher,Google,Private,Standards,"Co-inventor of Certificate Transparency (CT2 RFC 9162) at Google; contributor to quantum-safe PKI monitoring infrastructure; original OpenSSL developer; his CT log auditing mechanisms are being extended to support PQC certificate ecosystems.",https://ui-avatars.com/api/?name=Ben+Laurie&background=0b0d17&color=60a5fa&size=128&bold=true,https://www.google.com/,,RFC 6962
Hannes Tschofenig,Germany,"Professor; IETF Security Expert",Hochschule Bonn-Rhein-Sieg (H-BRS),Academic,Standards,"Professor at H-BRS and prolific IETF contributor; co-author of JOSE PQC KEM draft, DTLS 1.3 (RFC 9147), SUIT firmware update protocol (RFC 9019), and IoT device authentication standards; instrumental in bringing post-quantum cryptography to constrained IoT and embedded environments.",https://ui-avatars.com/api/?name=Hannes+Tschofenig&background=0b0d17&color=60a5fa&size=128&bold=true,https://www.h-brs.de/,,"draft-ietf-jose-pqc-kem;RFC 9147;RFC 9019;RFC 7250"
Paul Hoffman,USA,"Distinguished Engineer; IETF Veteran",ICANN,Private,Standards,"Distinguished Engineer at ICANN and long-time IETF contributor; co-author of IKEv2 (RFC 7296) and numerous internet security RFCs; significant contributor to DNS security (DNSSEC) and quantum-safe protocol integration in core internet infrastructure.",https://ui-avatars.com/api/?name=Paul+Hoffman&background=0b0d17&color=60a5fa&size=128&bold=true,https://www.icann.org/,,IETF RFC 7296
Carsten Bormann,Germany,"Professor; IETF Expert",Universität Bremen TZI,Academic,Standards,"Professor at Universität Bremen and leading IETF contributor; co-author of CBOR (Concise Binary Object Representation), CoAP (Constrained Application Protocol), and RFC 7228 defining IoT constraints taxonomy; his compact encoding standards enable PQC in constrained devices.",https://ui-avatars.com/api/?name=Carsten+Bormann&background=0b0d17&color=60a5fa&size=128&bold=true,https://www.uni-bremen.de/,,RFC 7228
Charlie Kaufman,USA,"Security Researcher; Standards Author",Microsoft,Private,Standards,"Primary author of IKEv2 (RFC 7296), the key negotiation protocol used in IPsec VPNs and a critical migration target for PQC-safe infrastructure; 30+ year contributor to internet security protocols and IETF security area working groups.",https://ui-avatars.com/api/?name=Charlie+Kaufman&background=0b0d17&color=60a5fa&size=128&bold=true,https://www.microsoft.com/,,IETF RFC 7296
Paul Wouters,Netherlands/USA,"Senior Software Engineer; IETF Expert",Red Hat,Private,Standards,"Senior Engineer at Red Hat and active IETF contributor; co-author of RFC 7250 (Using Raw Public Keys in TLS) and contributor to IKEv2/IPsec PQC integration; leads Fedora/RHEL cryptography policy enabling PQC algorithm support across Linux distributions.",https://ui-avatars.com/api/?name=Paul+Wouters&background=0b0d17&color=60a5fa&size=128&bold=true,https://www.redhat.com/,,RFC 7250
Rob Stradling,UK,Senior Research Engineer,Sectigo,Private,Standards,"Senior Research Engineer at Sectigo and co-author of Certificate Transparency v2 (RFC 9162); contributor to crt.sh certificate transparency log search and the broader CT ecosystem that forms the verification backbone for PQC certificate deployment monitoring.",https://ui-avatars.com/api/?name=Rob+Stradling&background=0b0d17&color=60a5fa&size=128&bold=true,https://sectigo.com/,,RFC-9162
John Gilmore,USA,"Co-Founder; Cryptography Advocate",Electronic Frontier Foundation (EFF),Private,Standards,"Co-founder of the Electronic Frontier Foundation (EFF) and cypherpunk; co-author of RFC 7250 (Using Raw Public Keys in TLS); early advocate for strong cryptography and export freedom; his work on minimal-state TLS authentication is relevant to constrained-environment PQC deployments.",https://ui-avatars.com/api/?name=John+Gilmore&background=0b0d17&color=60a5fa&size=128&bold=true,https://www.eff.org/,,RFC 7250
Katie Arrington,USA,Chief Information Officer (CIO),U.S. Department of Defense,Public,Government,"Chief Information Officer of the U.S. Department of Defense; issued the DoD PQC Migration Memo (2025) directing DoD components to begin preparing for migration to post-quantum cryptography; driving federal PQC adoption across the defense industrial base and supply chain.",https://ui-avatars.com/api/?name=Katie+Arrington&background=0b0d17&color=22d3ee&size=128&bold=true,https://dodcio.defense.gov/,,DoD-CIO-PQC-Memo-2025
Nat Sakimura,Japan,"Research Fellow; OpenID Foundation Chairman Emeritus",Nomura Research Institute (NRI),Private,Standards,"Co-author of JSON Web Signature (RFC 7515) and JSON Web Token (RFC 7519); lead designer of OpenID Connect; Chairman Emeritus of the OpenID Foundation; his identity token standards are fundamental migration targets for enterprise authentication requiring PQC-safe signatures.",https://ui-avatars.com/api/?name=Nat+Sakimura&background=0b0d17&color=60a5fa&size=128&bold=true,https://www.nri.com/,,"RFC 7515;RFC 7519"
Brendan Moran,Ireland,"Principal Architect; SUIT WG Co-Chair",Arm,Private,Standards,"Principal Architect at Arm and IETF SUIT Working Group co-chair; co-author of RFC 9019 (A Firmware Update Architecture for Internet of Things), defining secure firmware update mechanisms for IoT devices requiring PQC-safe signing as legacy hash-based algorithms are retired.",https://ui-avatars.com/api/?name=Brendan+Moran&background=0b0d17&color=60a5fa&size=128&bold=true,https://www.arm.com/,,RFC 9019
Stephen Davidson,Canada,"Standards Technology Strategist; S/MIME WG Chair",DigiCert,Private,Standards,"Chair of the CA/Browser Forum S/MIME Certificate Working Group; proposed CA/Browser Forum Ballot SMC013 enabling ML-DSA and ML-KEM in S/MIME certificates; DigiCert representative driving post-quantum migration standards for email security and publicly-trusted PKI.",https://ui-avatars.com/api/?name=Stephen+Davidson&background=0b0d17&color=60a5fa&size=128&bold=true,https://www.digicert.com/,,CA-B-Forum-Ballot-SMC013
Martijn Katerbarg,Netherlands,"Principal Technologist; CA/Browser Forum Contributor",Sectigo,Private,Standards,"Endorsed CA/Browser Forum Ballot SMC013 enabling ML-DSA and ML-KEM in S/MIME certificates; Sectigo representative to the CA/Browser Forum S/MIME Certificate Working Group; contributes to post-quantum certificate policy development for publicly-trusted certificate authorities.",https://ui-avatars.com/api/?name=Martijn+Katerbarg&background=0b0d17&color=60a5fa&size=128&bold=true,https://sectigo.com/,,CA-B-Forum-Ballot-SMC013
Clint Wilson,USA,"Security Engineer; CA/Browser Forum Contributor",Apple,Private,Standards,"Apple's representative to the CA/Browser Forum root program; endorsed Ballot SMC013/SMC014 enabling PQC algorithms in S/MIME certificates; shapes root store policy decisions governing post-quantum certificate trust and algorithm transitions for billions of Apple devices worldwide.",https://ui-avatars.com/api/?name=Clint+Wilson&background=0b0d17&color=60a5fa&size=128&bold=true,https://www.apple.com/,,CA-B-Forum-Ballot-SMC013
Ashish Dhiman,India,"Principal Engineer; CA/Browser Forum Contributor",GlobalSign,Private,Standards,"Endorsed CA/Browser Forum Ballot SMC013/SMC014 enabling post-quantum algorithms in S/MIME certificates; GlobalSign representative to the CA/Browser Forum driving adoption of ML-DSA and ML-KEM in publicly-trusted certificate authorities for quantum-safe email and document signing.",https://ui-avatars.com/api/?name=Ashish+Dhiman&background=0b0d17&color=60a5fa&size=128&bold=true,https://www.globalsign.com/,,CA-B-Forum-Ballot-SMC013
