Name,Country,Role,Organization,Type,Category,Contribution,ImageUrl,WebsiteUrl,LinkedinUrl,KeyResourceUrl
Andreas Henschel,Germany,"PKI Expert; CA/Browser Forum Contributor",D-Trust,Private,Standards,"Endorsed CA/Browser Forum Ballot SMC013 enabling ML-DSA and ML-KEM in S/MIME certificates; D-Trust (BSI subsidiary) representative to the CA/Browser Forum; drives post-quantum certificate standards for German and European digital identity infrastructure.",https://ui-avatars.com/api/?name=Andreas+Henschel&background=0b0d17&color=60a5fa&size=128&bold=true,https://www.d-trust.net/,,CA-B-Forum-Ballot-SMC013
Tony Cox,Australia,"PKCS#11 Specification Editor; Security Standards Expert",Cryptsoft,Private,Standards,"Lead editor of PKCS#11 v3.0 and v3.2 Cryptographic Token Interface Standards at OASIS; founder of Cryptsoft; his specifications define the HSM programming interface used by all hardware security modules implementing post-quantum algorithms including ML-KEM, ML-DSA, and SLH-DSA.",https://ui-avatars.com/api/?name=Tony+Cox&background=0b0d17&color=60a5fa&size=128&bold=true,https://www.cryptsoft.com/,,"PKCS11-V3-OASIS;PKCS11-V32-OASIS"
Robert Relyea,USA,"Senior Software Engineer; PKCS#11 TC Chair",Red Hat,Private,Standards,"OASIS PKCS#11 Technical Committee Chair for v3.1 and v3.2; Red Hat cryptography engineer and NSS (Network Security Services) developer; leads standardization of PKCS#11 post-quantum cryptography mechanisms enabling ML-KEM, ML-DSA, and SLH-DSA in open-source HSM implementations.",https://ui-avatars.com/api/?name=Robert+Relyea&background=0b0d17&color=60a5fa&size=128&bold=true,https://www.redhat.com/,,"PKCS11-V32-OASIS;PKCS11-V31-OASIS"
Dieter Bong,Germany,"Engineering Lead; PKCS#11 Editor",Utimaco,Private,Standards,"Editor of PKCS#11 v3.2 at OASIS and contributor to v3.0; Utimaco HSM engineer responsible for defining C_EncapsulateKey and C_DecapsulateKey extensions and ML-KEM, ML-DSA, and SLH-DSA mechanism specifications enabling post-quantum operations in hardware security modules.",https://ui-avatars.com/api/?name=Dieter+Bong&background=0b0d17&color=60a5fa&size=128&bold=true,https://utimaco.com/,,"PKCS11-V32-OASIS;PKCS11-V31-OASIS"
Valerie Fenwick,USA,"Principal Engineer; PKCS#11 TC Chair",Oracle,Private,Standards,"OASIS PKCS#11 Technical Committee Chair for v3.2; Oracle cryptography engineer co-chairing standardization of post-quantum interfaces for hardware security modules; instrumental in incorporating ML-KEM, ML-DSA, and SLH-DSA mechanisms and new KEM function signatures into the PKCS#11 v3.2 standard.",https://ui-avatars.com/api/?name=Valerie+Fenwick&background=0b0d17&color=60a5fa&size=128&bold=true,https://www.oracle.com/,,"PKCS11-V32-OASIS;PKCS11-V3-OASIS"
Luke Valenta,USA,"Research Engineer; Cryptography Researcher",Cloudflare,Private,Industry Adopter,"Co-author of Cloudflare's Merkle Tree Certificates proposal redesigning WebPKI for post-quantum authentication; contributor to the annual State of the Post-Quantum Internet research; leads Cloudflare's work on reducing TLS handshake sizes while enabling PQC certificate deployment at scale.",https://ui-avatars.com/api/?name=Luke+Valenta&background=0b0d17&color=10b981&size=128&bold=true,https://research.cloudflare.com/,,"Cloudflare-MTC-Blog;Cloudflare-PQ-Internet-2025"
Christopher Patton,USA,"Research Engineer; Cryptography Researcher",Cloudflare,Private,Industry Adopter,"Co-author of Cloudflare's Merkle Tree Certificates proposal redesigning WebPKI for quantum-safe authentication; contributor to IETF PQUIP working group and IKEv2 post-quantum standardization; Cloudflare researcher advancing quantum-safe protocol deployment across the Internet.",https://ui-avatars.com/api/?name=Christopher+Patton&background=0b0d17&color=10b981&size=128&bold=true,https://research.cloudflare.com/,,Cloudflare-MTC-Blog
Vânia Gonçalves,Portugal,"Research Engineer; Cryptography Researcher",Cloudflare,Private,Industry Adopter,"Co-author of Cloudflare's Merkle Tree Certificates proposal redesigning WebPKI for post-quantum cryptographic authentication; Cloudflare researcher contributing to the technical foundation for quantum-safe certificate deployment that dramatically reduces TLS handshake overhead from PQC signature sizes.",https://ui-avatars.com/api/?name=Vania+Goncalves&background=0b0d17&color=10b981&size=128&bold=true,https://research.cloudflare.com/,,Cloudflare-MTC-Blog
Craig Gidney,USA,"Senior Research Scientist; Quantum Software Engineer",Google Quantum AI,Private,Algorithm Inventor,"Google Quantum AI researcher whose work on quantum circuit optimization and Shor's algorithm resource estimation provides key benchmarks for the quantum computing power required to break RSA and elliptic curve cryptography; his published qubit count analyses directly inform PQC migration urgency timelines used by NIST, NSA, and global policymakers.",https://ui-avatars.com/api/?name=Craig+Gidney&background=0b0d17&color=f59e0b&size=128&bold=true,https://quantumai.google/,,Cloudflare-PQ-Internet-2025
Yilei Chen,China,"Professor; Cryptographer",Tsinghua University,Academic,Algorithm Inventor,"Researcher who published a 2024 paper proposing a quantum algorithm that appeared to threaten the security of lattice-based cryptographic schemes underlying ML-KEM and ML-DSA; the work (later found to have a flaw) prompted NIST to intensify security analysis of finalized PQC standards and underscored the importance of ongoing cryptographic research for quantum-safe migration.",https://ui-avatars.com/api/?name=Yilei+Chen&background=0b0d17&color=f59e0b&size=128&bold=true,https://www.tsinghua.edu.cn/,,Cloudflare-PQ-Internet-2025
Samuel Jaques,Canada,"Research Fellow; Quantum Cryptanalyst",University of Waterloo,Academic,Algorithm Inventor,"University of Waterloo researcher specializing in quantum algorithm resource estimation for cryptanalysis; his work on precise qubit and gate count benchmarks for quantum attacks on classical cryptosystems informs security parameter selection for NIST PQC standard algorithms and global migration timeline planning.",https://ui-avatars.com/api/?name=Samuel+Jaques&background=0b0d17&color=f59e0b&size=128&bold=true,https://uwaterloo.ca/,,Cloudflare-PQ-Internet-2025
Valery Smyslov,Russia,"Network Security Expert; IKEv2 Author",ELVIS-PLUS,Private,Standards,"Author of RFC 9593 (Announcing Supported Authentication Methods in IKEv2) enabling PQC signature algorithm negotiation in IPsec VPNs; prolific IETF IPsecME working group contributor driving standardization of ML-KEM and ML-DSA integration in IKEv2 — the key protocol for enterprise VPN post-quantum migration.",https://ui-avatars.com/api/?name=Valery+Smyslov&background=0b0d17&color=60a5fa&size=128&bold=true,,,RFC 9593
Meltem Sönmez Turan,USA,"Research Scientist; Cryptographer",NIST,Public,Government,"NIST cryptographer and co-author of NIST SP 800-56C Revision 2 (Key-Derivation Methods in Key-Establishment Schemes) and NIST SP 800-108 Revision 1 (Key Derivation using PRFs); her work on key derivation standards underpins post-quantum key management implementations and hybrid classical/PQC key establishment in federal systems.",https://ui-avatars.com/api/?name=Meltem+Sonmez+Turan&background=0b0d17&color=22d3ee&size=128&bold=true,https://csrc.nist.gov/,,"NIST-SP-800-56C-R2;NIST-SP-800-108-R1"
John Kelsey,USA,"Research Scientist; Cryptographer",NIST,Public,Government,"NIST cryptographer and co-author of the NIST PQC Standardization status reports (NIST IR 8413, 8545) documenting the selection of ML-KEM, ML-DSA, SLH-DSA, and HQC; contributor to key derivation standards (NIST SP 800-56C R2); a foundational contributor to the decade-long NIST PQC standardization process.",https://ui-avatars.com/api/?name=John+Kelsey&background=0b0d17&color=22d3ee&size=128&bold=true,https://csrc.nist.gov/,,"NIST IR 8413;NIST-SP-800-56C-R2"
Quynh Dang,USA,"Research Scientist; Cryptographer",NIST,Public,Government,"NIST cryptographer and co-author of NIST IR 8413 (Third Round PQC Status Report) and NIST SP 800-56C Revision 2; contributes to NIST key management and post-quantum standardization research; her technical work on key derivation methods supports quantum-safe cryptographic implementations across federal infrastructure.",https://ui-avatars.com/api/?name=Quynh+Dang&background=0b0d17&color=22d3ee&size=128&bold=true,https://csrc.nist.gov/,,"NIST IR 8413;NIST-SP-800-56C-R2"
Romain Alléaume,France,"Professor; QKD Standards Expert",Télécom Paris (IMT),Academic,Standards,"Professor at Télécom Paris and contributor to ETSI GS QKD 012 (Device and Communication Channel Parameters); active in ETSI QKD Industry Specification Group driving interoperability standards for quantum key distribution networks; his research bridges theoretical QKD security proofs and practical network deployment.",https://ui-avatars.com/api/?name=Romain+Alleaume&background=0b0d17&color=60a5fa&size=128&bold=true,https://www.telecom-paris.fr/,,ETSI-GS-QKD-012
Marco Lucamarini,UK,"Principal Research Scientist; QKD Expert",Toshiba Research Europe,Private,Algorithm Inventor,"Toshiba Research Europe QKD researcher and contributor to ETSI GS QKD 012; co-inventor of Twin-Field QKD, a breakthrough protocol that dramatically extends the distance over which quantum key distribution can operate beyond the repeaterless bound, enabling practical long-distance quantum-safe key exchange.",https://ui-avatars.com/api/?name=Marco+Lucamarini&background=0b0d17&color=f59e0b&size=128&bold=true,https://www.toshiba.eu/pages/eu/Cambridge-Research-Laboratory/,,ETSI-GS-QKD-012
Bruno Huttner,Switzerland,Chief Quantum Officer,ID Quantique,Private,Industry Vendor,"Chief Quantum Officer at ID Quantique, the world's leading commercial QKD provider; contributor to ETSI GS QKD 014 REST-based Key Delivery API standard; drives commercial quantum key distribution deployment and integration of QKD with post-quantum cryptography in hybrid security architectures for financial, government, and critical infrastructure clients.",https://ui-avatars.com/api/?name=Bruno+Huttner&background=0b0d17&color=a78bfa&size=128&bold=true,https://www.idquantique.com/,,ETSI-GS-QKD-014
Peter Bordow,USA,"Distinguished Engineer; FS-ISAC PQC Workgroup Chair",Wells Fargo,Private,Industry Adopter,"Distinguished Engineer and Managing Director of Quantum Security at Wells Fargo; Chair of the FS-ISAC Post-Quantum Cryptography Workgroup leading the financial sector's collective response to quantum threats; drives PQC migration standards, best practices, and risk frameworks for the global financial services industry.",https://ui-avatars.com/api/?name=Peter+Bordow&background=0b0d17&color=10b981&size=128&bold=true,https://www.wellsfargo.com/,,Europol-FS-ISAC-PQC-Financial-2026
Steve Stevens,USA,Executive Director,Accredited Standards Committee X9,Private,Standards,"Executive Director of ASC X9, the ANSI-accredited standards body for the US financial services industry. Leads X9 initiatives on post-quantum cryptography including the X9 Financial PKI (launched June 2025 with DigiCert), the X9 PQC Financial Readiness Needs Assessment, and the quantum computing risk study program. Drives cross-sector adoption of PQC standards for payment systems, PKI, and financial cryptographic infrastructure.",https://ui-avatars.com/api/?name=Steve+Stevens&background=0b0d17&color=60a5fa&size=128&bold=true,https://x9.org/,https://www.linkedin.com/in/steve-stevens-5b06892/,"ASC-X9-Financial-PKI;ASC-X9-PQC-Readiness-2025;ASC-X9-IR-F01-2022"
Roy C. DeCicco,USA,"Former Chair, ASC X9; Managing Director",JPMorgan Chase,Private,Standards,"Former Chair of ASC X9 (until 2021); led the committee during the development of foundational financial cryptography standards including the X9 TR 50-2019 on Quantum Techniques in CMS and the initial quantum computing risk assessment for the financial industry. Managing Director at JPMorgan Chase responsible for cryptographic standards and financial PKI governance.",https://ui-avatars.com/api/?name=Roy+C+DeCicco&background=0b0d17&color=60a5fa&size=128&bold=true,https://x9.org/,,"ASC-X9-TR-50-2019;ASC-X9-IR-F01-2022"
Angela Hendershott,USA,Vice Chair,Accredited Standards Committee X9,Private,Standards,"Vice Chair of ASC X9; supports governance and standards development for the financial services industry including post-quantum cryptography transition initiatives. Contributes to X9 standards for financial PKI, cryptographic key management, and the quantum computing risk framework for financial institutions.",https://ui-avatars.com/api/?name=Angela+Hendershott&background=0b0d17&color=60a5fa&size=128&bold=true,https://x9.org/,,ASC-X9-TR-50-2019
Shuichi Katsumata,UK,Lead Cryptography Researcher,PQShield,Private,Algorithm Inventor,"Lead cryptography researcher at PQShield advancing lattice-based cryptography theory; contributor to ML-KEM security analysis and hybrid key exchange IETF standardization; his theoretical work on tightly-secure lattice signatures and modular lattice schemes strengthens the cryptographic foundations of NIST PQC standards.",https://ui-avatars.com/api/?name=Shuichi+Katsumata&background=0b0d17&color=f59e0b&size=128&bold=true,https://pqshield.com/,,FIPS 203
