software_name,category_id,category_name,infrastructure_layer,pqc_support,pqc_capability_description,license_type,license,latest_version,release_date,fips_validated,pqc_migration_priority,primary_platforms,target_industries,authoritative_source,repository_url,product_brief,source_type,verification_status,last_verified_date,migration_phases,learning_modules,vendor_id,trusted_source_id,evidence_flags
AWS Application Load Balancer (ALB),CSC-028,Cloud Encryption Gateways,"Cloud, Network",No,Managed load balancing service. AWS rolled out hybrid ML-KEM TLS support to ALB and NLB endpoints enabling enterprises to achieve quantum-safe data-in-transit without modifying application code.,Proprietary,Commercial (AWS),Current,2025,Yes (AWS-LC FIPS 140-3),Critical,"AWS (Amazon EC2, Containers, Lambda functions, IP addresses), AWS Outposts, On-premises (via Direct Connect or VPN)",All industries,https://aws.amazon.com/elasticloadbalancing/application-load-balancer,,Load balance HTTP and HTTPS traffic with advanced request routing targeted at the delivery of modern applications.,Trusted Vendor,Verified,2026-02-21,"migrate,launch,rampup",tls-basics;web-gateway-pqc,VND-001,amazon-aws,
Cloudflare Edge Network,CSC-028,Cloud Encryption Gateways,"Network, Security Stack, Cloud, Hardware",Yes (X25519MLKEM768 enabled by default; ML-KEM),"Deploys post-quantum hybrid key agreements using X25519MLKEM768 (default for modern browsers/OS) and X25519Kyber768Draft00. Supported via Cloudflare's fork of Go, OpenSSL 3.5.0+, Node.js, BoringSSL, GnuTLS, rustls, and NGINX.",Proprietary,Proprietary,Current,2025-11-04 (Document last updated),Yes (Edge platform),High,"Cloudflare Edge Network, AWS, Azure, Google Cloud, IBM Cloud, Entrust, Fortanix; Browsers: Firefox, Chrome, Safari, Edge, Opera, Brave, Tor.","Enterprise, General Internet Services",https://developers.cloudflare.com/ssl/post-quantum-cryptography/pqc-support/index.md,,"Global network infrastructure providing security, reliability, and post-quantum cryptography support via Anycast data centers.",Trusted Vendor,Verified,2026-02-21,"migrate,launch,rampup",tls-basics;web-gateway-pqc,VND-057,cloudflare,no-cert-backing
JFrog Artifactory,CSC-040,CI/CD & Artifact Management,Application,No,"The provided text does not mention Post-Quantum Cryptography (PQC), PQC algorithms, or any plans for PQC migration. It focuses on artifact management, vulnerability scanning, and standard software supply chain security.",Commercial,"Proprietary (implied by ""Commercial"", ""Renew, retrieve licenses"", and ""JFrog Enterprise+"")",Current,2026,No,Low,"SaaS, self-managed, multi-cloud, hybrid; supports Kubernetes, Docker, Maven, Gradle, Helm, npm, NuGet, Conan, Poetry.","Financial Services, Public Sector, Technology, Healthcare, Gaming, Automotive, Enterprise",https://jfrog.com/artifactory/,,"Universal Artifact & ML Model Repository Manager for software supply chain visibility, security, and control.",Trusted Vendor,Partially Verified,2026-03-25,migrate,code-signing;platform-eng-pqc,VND-174,ietf,
Sonatype Nexus,CSC-040,CI/CD & Artifact Management,"Application, Cloud",No,"The document does not mention Post-Quantum Cryptography (PQC), PQC algorithms, or any plans for PQC migration. It only mentions general security features like TLS encryption and malware protection.",Open Source/Commercial,Community Edition (Free/Open Source) and Pro Edition (Commercial/Paid). Specific license names not stated.,Current,2026,No,High,"AWS, Microsoft Azure, OpenShift, Self-hosted (data centers), Air-gapped environments; supports CI/CD tools like GitHub, GitLab, Bitbucket, Jenkins.","Government, Financial Services, Technology, Manufacturing, Healthcare, Retail, Telecommunications.",https://www.sonatype.com/products/nexus-repository,,"Cloud-native binary artifact management tool to store, manage, and distribute software applications, AI/ML models, and components.",Trusted Vendor,Partially Verified,2026-03-25,migrate,code-signing;platform-eng-pqc,VND-182,ietf,
CyberArk Conjur,CSC-053,Secrets Management,"Security Stack, Cloud, Application",Planned,Secrets management solution. Relies on standard cryptographic algorithms like AES and RSA. PQC integration into core secrets features is planned.,Open Source/Commercial,Proprietary (for SaaS/Self-Hosted); Open Source (for Conjur Secrets Manager Open Source). Specific license names not stated.,Current,2026,Yes (FIPS mode),High,"Multi-cloud, on-prem, containerized environments, CI/CD pipelines; integrates with AWS Secrets Manager and Azure Key Vault via Secrets Hub.","Automotive, Banking, Critical Infrastructure, Financial Services, Government, Healthcare, Insurance, Manufacturing, Managed Service Providers.",https://www.cyberark.com/,,"Centrally manage secrets for all application identities across multi-cloud, on-prem, and containerized environments.",Trusted Vendor,Partially Verified,2026-03-25,"migrate,launch,rampup",iam-pqc;kms-pqc;secrets-management-pqc,VND-162,nist-csrc,
Keyfactor Command,CSC-041,Certificate Lifecycle Management,"Security Stack, Cloud, Application",Yes (ML-DSA; SLH-DSA),"Supports discovery of post-quantum (PQ) and hybrid certificates via real-time visibility. Offers a ""PQC Lab"" sandbox for quantum readiness and resources. Mentions ""Quantum-ready algorithms"" and Key Encapsulation Mechanisms (KEMs) in educational content, but specific algorithm names are not listed in the product feature text.",Commercial / Open Source,Commercial,25.x,2025,"Partial (Bouncy Castle APIs are described as ""FIPS-Certified""; HSM FIPS mode is discussed in educational content, but no specific validation statement for Keyfactor Command itself).",High,"On-premises data centers, Cloud (Azure mentioned for SaaS Lite), Kubernetes clusters.","Financial Services, Telecom, Automotive, Medical, Industrial IoT, Consumer IoT, Software & IT.",https://www.keyfactor.com/products/command/,,"Platform that discovers, protects, and automates every certificate across any CA, cloud, and machine.",Trusted Vendor,Verified,2026-03-25,"assess,migrate",arch-quantum-impact;compliance-strategy;healthcare-pqc;kms-pqc;merkle-tree-certs;migration-program;ops-quantum-impact;pki-workshop;pqc-governance;vendor-risk,VND-024,keyfactor,no-cert-backing
Venafi TLS Protect,CSC-041,Certificate Lifecycle Management,Security Stack,Yes (Experimental ML-DSA SLH-DSA),"Machine Identity Management platform supporting experimental issuance and lifecycle management of PQC certificates (ML-DSA, SLH-DSA). Enables discovery and inventory of classical certificates for PQC migration planning. TLS Protect Cloud includes quantum-readiness dashboards.",Commercial,"Proprietary (Implied by ""CyberArk Software Ltd. All rights reserved"" and subscription model)",25.x,2025,No,Critical,"Cloud-native, on-premises, third-party applications (General deployment targets mentioned); Kubernetes (specifically for Certificate Manager for Kubernetes).","Automotive, Banking, Critical Infrastructure, Financial Services, Government, Healthcare, Insurance, Manufacturing, Managed Service Providers.",https://docs.venafi.com/Docs/24.3/TopNav/Content/CodeSigning/t-codesigning-pqc.php,,"Automation platform for certificate lifecycle management, enterprise PKI, and machine identity security.",Trusted Vendor,Verified,2026-03-25,"assess,migrate",arch-quantum-impact;compliance-strategy;healthcare-pqc;merkle-tree-certs;migration-program;ops-quantum-impact;pki-workshop;pqc-business-case;vendor-risk,VND-059,iec,no-cert-backing
AppViewX CERT+,CSC-041,Certificate Lifecycle Management,"Security Stack, Cloud, Application",Yes (PQC Test Center; PQC Assessment Tool; quantum-ready PKIaaS; ML-DSA SLH-DSA Catalyst),"Offers AVX ONE PQC Assessment Tool for crypto risk assessment and CBOM generation; supports quantum-ready PKIaaS issuing FIPS 203, FIPS 204, FIPS 205, and upcoming FIPS 206 (FALCON) algorithms; enables crypto-agility for rapid transition to PQC.",Commercial,Proprietary,Current,2025-04-23,"Yes (FIPS 140-2 certified HSMs mentioned for code signing; FIPS 203, 204, 205, 206 algorithms supported)",High,"Hybrid multi-cloud environments, Kubernetes, containers, on-premises, private cloud, SaaS.","Enterprise, Healthcare (PacificSource), Finance (Rabobank), Government (Australian Bureau of Statistics).",https://www.appviewx.com/post-quantum-readiness/,,"The most advanced SaaS certificate lifecycle management (CLM) platform for enterprise PKI, IAM, security, DevOps, cloud, and application teams.",Trusted Vendor,Verified,2026-03-30,"assess,migrate",5g-security;arch-quantum-impact;healthcare-pqc;merkle-tree-certs;migration-program;ops-quantum-impact;pki-workshop,VND-167,iec,
Okta Workforce Identity,CSC-042,Identity & Access Management (IAM),"Security Stack, Cloud",No,"The document does not mention Post-Quantum Cryptography (PQC), quantum-resistant algorithms, or migration plans for PQC. It mentions OIDC ID Token Encryption using JSON Web Encryption (JWE) but does not specify the underlying cryptographic primitives as PQC.",Commercial,"Proprietary (Implied by ""© Okta and/or its affiliates. All rights reserved."" and commercial nature).",Current,"2025-07-01 (Context: Q3 2025 release overview, July - September 2025)",No (Document mentions FedRAMP High/Moderate and NIST SP 800-63C FAL3 compliance but does not explicitly state FIPS 140-2 or 140-3 validation status).,Critical,"Cloud Apps, On Prem Servers, Public/Private Directories, Kubernetes (mentioned in context of Axiom integration), Databases.","Enterprise, Government (Federal/US Military), Healthcare (HIPAA customers).",https://www.okta.com/resources/whitepaper/okta-and-post-quantum-cryptography/,,"An identity security fabric platform securing employees, apps, and AI agents with governance and access management.",Trusted Vendor,Verified,2026-02-21,"migrate,launch",digital-id;iam-pqc,VND-060,iec,
Keycloak,CSC-042,Identity & Access Management (IAM),Security Stack,Planned,Open source identity and access management. Community exploring hybrid PQC signature support (RSA + ML-DSA) for SAML assertions and OIDC tokens. Full PQC token signatures dependent on Java ecosystem (Bouncy Castle) and IETF JOSE/COSE standards. PQC TLS possible via JVM configuration.,Open Source,Apache-2.0,26.x,2026-03-06 (Last Updated date provided; specific release date not stated),No,Critical,Docker Kubernetes Java Linux,All industries,https://github.com/keycloak/keycloak,https://github.com/keycloak/keycloak,Open source IAM standard. PQC token signature support planned via Java/Bouncy Castle ecosystem and IETF JOSE PQC algorithm adoption.,Open Source Foundation,Verified,2026-02-21,"migrate,launch",api-security-jwt;crypto-dev-apis;digital-id;iam-pqc,VND-032,microsoft,
Ping Identity PingFederate,CSC-042,Identity & Access Management (IAM),"Security Stack, Cloud, Application",Planned,Enterprise federation and SSO server. Ping Identity (merged with ForgeRock under Thales) has published PQC migration guidance. Hybrid authentication with PQC digital signatures planned for SAML and OIDC flows. TLS quantum safety addressable via JVM crypto providers.,Commercial,"Proprietary (Implied by ""Ping Products"" and commercial sales context)",13.0,2025,Yes (FIPS 140-2),High,"On-premises, Cloud, SaaS, Hybrid IT environments; integrates with Office 365, Apache, Java.","Enterprise (Workforce, Customers, Partners)",https://www.pingidentity.com/,,Enterprise federation server with PQC roadmap for hybrid authentication signatures across SAML and OIDC protocols.,Trusted Vendor,Verified,2026-03-30,"migrate,launch",5g-security;crypto-dev-apis;digital-id;healthcare-pqc;iam-pqc;migration-program,VND-178,iec,
Thales CipherTrust Data Security Platform,CSC-043,Data Security & Protection,"Security Stack, Hardware, Network","Yes (with details: NIST-standardized ML-KEM, ML-DSA, LMS/HSS, and Falcon/FN-DSA integrated in firmware; hybrid modes supported)","Thales integrates PQC algorithms (ML-KEM, ML-DSA, LMS/HSS, Falcon) directly into Luna HSM firmware and High Speed Encryptors. Supports hybrid PQC/classical protection for data-in-motion (Layers 2–4), PKI, TLS, code signing, and key management. Includes crypto-agility to shift between classical and PQC algorithms. MultiApp v5.2 Premium PQC is CC EAL6+ certified.",Commercial,Proprietary (Not explicitly stated as Open Source; described as commercial solutions and products),MultiApp v5.2 Premium PQC; Java Card standard release v3.3 (planned for 2026),2025,Yes (Luna HSMs are FIPS 140-3 Level 3 platforms; Falcon is FIPS 206),"Critical (Document states ""urgent to plan and execute"" by 2030/2035; addresses ""Harvest Now, Decrypt Later"" threats for critical systems)","Production-proven systems, mobile networks (5G), cloud infrastructures, embedded environments (IoT, automotive), secure elements (eSIM, ePassports)","Finance (Wells Fargo, HSBC), Telecom (SK Telecom, GSMA), Government/Defense (Canada's DIGITAL/NDEC), Identity/Travel (ICAO), Enterprise",https://cpl.thalesgroup.com/encryption/ciphertrust-data-security-platform,,"A comprehensive security infrastructure platform providing quantum-safe key management, PKI, data protection, and identity credentials via HSMs and secure elements.",Trusted Vendor,Verified,2026-02-21,"launch,rampup",aerospace-pqc;data-asset-sensitivity;database-encryption-pqc;healthcare-pqc;hsm-pqc,VND-041,thales-research,
IBM Security Guardium Data Protection,CSC-043,Data Security & Protection,"Security Stack, Cloud",No,Enterprise data activity monitoring and protection platform. IBM has committed to quantum-safe cryptography migration across its security portfolio per NIST PQC standards. Guardium encryption and key management integration with IBM HPCS (Hyper Protect Crypto Services) targets ML-KEM for data-at-rest protection.,Commercial,"Proprietary (implied by ""Book a live demo"", ""Commercial"" context of IBM products, no open source license mentioned)",12.2.1,2025,Yes (FIPS 140-2),High,"Hybrid cloud infrastructure, SaaS environments, edge gateway; supports agents or agentless universal connector plug-ins.","Enterprise (implied by ""enterprise data"", ""hybrid cloud"", compliance standards like PCI DSS, GDPR, SOX).",https://www.ibm.com/products/guardium-data-protection,,"Secure enterprise data and simplify compliance across hybrid cloud infrastructure with discovery, monitoring, and real-time protection.",Trusted Vendor,Partially Verified,2026-03-25,"launch,rampup",data-asset-sensitivity;database-encryption-pqc;healthcare-pqc;kms-pqc,VND-019,q360-alliance,
Virtru Data Protection,CSC-043,Data Security & Protection,Security Stack,Planned,Zero-trust data protection using Trusted Data Format (TDF) for persistent file and email encryption. Virtru has announced plans to integrate ML-KEM for key encapsulation in TDF envelopes to protect against Harvest Now Decrypt Later attacks on sensitive documents.,Commercial / Open Source (Platform is commercial; built upon the open-source OpenTDF project),Commercial,Current,2025,"No (Text mentions compliance with NIST standards generally, but does not explicitly state FIPS 140-2 or 140-3 validation status).",High,"Google Workspace (Gmail, Drive), Microsoft 365 (Outlook, OneDrive, SharePoint), Desktop, Zendesk, Confluence, Data Lakes, Windows.","Commercial, Aerospace, Education, Finance, Healthcare, Technology & Telecom, Threat Intelligence, Government, Defense, Intelligence, State & Local, Systems Integrators.",https://www.virtru.com/data-protection/,,A data-centric security platform built on the open Trusted Data Format (TDF) standard for persistent control over shared information.,Trusted Vendor,Partially Verified,2026-03-25,"launch,rampup",aerospace-pqc;data-asset-sensitivity;database-encryption-pqc;healthcare-pqc,VND-188,ietf,
Auth0 (Okta Customer Identity),CSC-044,Customer Identity & Access Management (CIAM),"Security Stack, Application",No,Customer identity and access management platform. PQC TLS transport available via Okta cloud infrastructure. OIDC token signatures for customer-facing applications awaiting IETF PQC JOSE/COSE standard finalization. Auth0 Actions extensibility enables future hybrid PQC authentication flows.,Open Source/Commercial,"MIT, Apache-2.0 (for specific repositories like auth0-spa-js, Auth0.swift); Commercial (implied for the platform itself).",Current,2026,No,High,"Single Page Applications (SPA), Next.js, Apple platforms, Android, React, Python, FastAPI, JavaScript browsers.","Enterprises, Small and medium teams, Startups, Nonprofits, Healthcare, Financial services, Manufacturing, Government.",https://auth0.com,https://github.com/auth0,Customer Identity & Access Management platform providing authentication SDKs and tools.,Trusted Vendor,Pending Verification,2026-02-21,"migrate,launch",digital-id;healthcare-pqc;iam-pqc,VND-060,microsoft,
Intel TDX (Trust Domain Extensions),CSC-052,Confidential Computing,"Hardware, Cloud",No,Intel TDX provides hardware-isolated Trusted Execution Environments (TEEs) at the VM level using architectural extensions on 4th/5th Gen Xeon processors. TDX Trust Domains protect data-in-use from hypervisor and host OS. PQC attestation report signing planned; current remote attestation uses ECDSA P-256 via Intel PCS. Combines with ML-KEM encrypted memory sealing on roadmap.,Open Source/Commercial,GPL-2.0 (for the `intel/tdx` repository source code); Commercial availability via cloud providers.,"2.0 (mentioned as ""Intel TDX version 2.0 extends Intel TDX to support Trusted Execution Environment for device I/O""); also mentions incompatibilities between v1.0 and v1.5.",2024,No,High,"Alibaba Cloud, Microsoft Azure, Google Cloud, Intel® Developer Cloud; 4th Generation Intel® Xeon® Scalable Processors.","Data Security and IP Protection, Privacy and Compliance, Data Sovereignty, Confidential AI.",https://github.com/intel/tdx,https://github.com/intel/tdx,Hardware-based trusted execution environment facilitating hardware-isolated virtual machines to protect sensitive data and applications.,Trusted Vendor,Verified,2026-02-21,"prepare,migrate,launch",confidential-computing;healthcare-pqc;migration-program,VND-022,cmvp,
AMD SEV-SNP (Secure Encrypted Virtualization),CSC-052,Confidential Computing,"Hardware, Cloud (via hypervisor support), Security Stack",No,AMD SEV-SNP provides hardware memory encryption per VM with strong integrity guarantees and attestation on EPYC processors. Each VM gets a unique AES-128 memory encryption key. SNP attestation reports currently signed with ECDSA P-384. AMD has indicated PQC attestation signing (ML-DSA) on roadmap for future EPYC generations to counter quantum threats to remote attestation.,Open Source,MIT,EPYC Turin (5th Gen),2026-03-03 (Last Updated timestamp in repository metadata),No,High,"SLES-15, RHEL-8, Fedora-28, Fedora-29, Ubuntu-18.04, openSUSE-Tumbleweed; requires AMD processors with SEV support.",Cloud Finance Healthcare Government,https://github.com/AMDESE/AMDSEV,https://github.com/AMDESE/AMDSEV,Hardware VM memory encryption with integrity via AMD TEE. PQC attestation signing planned for future EPYC generations to ensure quantum-safe workload trust.,Trusted Vendor,Verified,2026-03-25,"prepare,migrate,launch",confidential-computing;healthcare-pqc,VND-148,microsoft,
ARM Confidential Compute Architecture (CCA),CSC-052,Confidential Computing,Hardware,No,"The document does not mention Post-Quantum Cryptography, PQC algorithms, or migration plans. It focuses on confidential computing via hardware isolation (Realms) rather than specific cryptographic algorithm updates for quantum resistance.",Proprietary / Open Source components,"Arm architecture specifications are licensed by partners; reference software (TF-RMM, TF-A Monitor) is available at TrustedFirmware.org.",ARMv9-A (Cortex-A Series),2025,No,High,"Armv9-A CPUs with Realm Management Extension (RME); supports Mobile, PC, Datacenter, and Automotive via Lumex, Neoverse, and Zena CSS.","AI, Healthcare, Financial Services, Industrial Systems, Cloud Computing, Automotive, IoT.","https://www.arm.com (inferred from text context ""Arm Global Headquarters"" and domain references, though specific product URL not explicitly listed as a single link).",https://github.com/ARM-software/cca-rmm-acs,Hardware-based trusted execution environments using Realm Management Extension to isolate AI models and data.,Trusted Vendor,Verified,2026-03-25,"prepare,migrate,launch",aerospace-pqc;confidential-computing,VND-149,microsoft,
Google Cloud KMS,CSC-045,Cloud Key Management Service (KMS),"Cloud, Security Stack, Hardware",Yes (ML-KEM Preview / ML-DSA Preview),"PQC signing algorithms are in ""Preview"" status under Pre-GA Offerings Terms. Supported signing algorithms include ML-DSA-65 (Module-lattice-based) and SLH-DSA-SHA2-128S (Stateless hash-based), available as pure or pre-hash variants. Key Encapsulation Mechanisms (KEMs) are fully supported with ML-KEM-768, ML-KEM-1024 (FIPS 203), and KEM-XWING (hybrid).",Commercial,Proprietary (subject to General Service Terms and Pre-GA Offerings Terms),Current,2025-10,Yes (ML-KEM algorithms reference FIPS 203 parameter sets; specific module validation status not explicitly detailed beyond algorithm standards).,High,Google Cloud Platform,"Enterprise, Government, General Cloud Users",https://cloud.google.com/kms/docs/algorithms,,"A cloud key management service providing encryption, signing, and key encapsulation with software and HSM protection levels.",Trusted Vendor,Verified,2026-03-30,"migrate,launch,rampup",database-encryption-pqc;kms-pqc;secrets-management-pqc,VND-018,google,ml-kem-may-be-preview-not-ga
AWS KMS,CSC-045,Cloud Key Management Service (KMS),"Cloud, Security Stack",No,ML-DSA digital signatures (FIPS 204) GA since June 2025 with ML-DSA-44/65/87 key specs via CreateKey/Sign/Verify APIs in FIPS 140-3 L3 HSMs. ML-KEM hybrid TLS for API transit protection via AWS-LC. PQC key import (BYOK) not supported — ML-DSA keys must be generated in KMS. External Key Store (XKS) symmetric-only — no PQC HYOK. AWS Private CA supports ML-DSA certificate issuance for code signing workflows.,"Proprietary (Service), Open Source (SDK)",Apache 2.0 (for AWS Encryption SDK); Commercial/Proprietary (for AWS KMS service),Current,2025,"Yes, FIPS 140-3 Security Level 3 validated hardware security modules (HSM)",Critical,"AWS Cloud; AWS Encryption SDK supports C, .NET, Java, JavaScript, Python, Rust, Go",All industries,https://aws.amazon.com/kms/,,Managed cloud KMS with GA ML-DSA signing (FIPS 204) in FIPS 140-3 L3 HSMs. ML-KEM hybrid TLS for transit. No PQC BYOK/HYOK. AWS Private CA enables ML-DSA code signing.,Trusted Vendor,Verified,2026-02-24,"migrate,launch,rampup",database-encryption-pqc;hsm-pqc;kms-pqc;secrets-management-pqc,VND-001,amazon-aws,
Azure Key Vault,CSC-045,Cloud Key Management Service (KMS),Cloud,Planned,Microsoft cloud key management and secrets service. Underlying SymCrypt library supports ML-KEM and ML-DSA available via Windows CNG but not yet exposed as Azure Key Vault key types for customer operations. Managed HSM uses Marvell LiquidSecurity HSM. Microsoft targets quantum-safe key vault key types by 2029 per CNSA 2.0 compliance roadmap.,Commercial,Proprietary (Microsoft Azure service),Current,2026,Yes (FIPS 140-2 L1 software / L3 Managed HSM),Critical,Microsoft Azure (Cloud),"Enterprise, Small and Medium Businesses (mentioned in ""Cloud solutions for small and medium businesses"")",https://azure.microsoft.com/en-us/products/key-vault,,"A cloud service for securely storing and accessing secrets, including API keys, passwords, certificates, and cryptographic keys.",Trusted Vendor,Verified,2026-02-21,"migrate,launch,rampup",database-encryption-pqc;hsm-pqc;kms-pqc;migration-program;pqc-business-case;secrets-management-pqc,VND-027,microsoft,
Thales Luna Cloud HSM (DPoD),CSC-046,Cloud Hardware Security Module (HSM),"Cloud, Hardware, Network","Yes (with details: Integrates ML-KEM, ML-DSA, LMS/HSS; supports hybrid modes)","Luna HSMs are among the first FIPS 140-3 Level 3 platforms to integrate NIST-standardized PQC algorithms (ML-KEM, ML-DSA, LMS/HSS) directly in firmware. Supports quantum-safe key management, TLS, PKI, and code signing on production-proven systems with hybridization capabilities.",Commercial,Proprietary,MultiApp v5.2 Premium PQC (Smartcard); Luna T-Series (HSM version not specified),2026-02,Yes (FIPS 140-3 Level 3 for Luna HSMs; Falcon is FIPS 206),Critical,"Cloud infrastructures, U.S. Government intelligence/defense/civilian agencies, commercial enterprises, mobile networks (5G), embedded environments","Finance, Government, Defense, Telecom, Identity Management, Critical Infrastructure",https://cpl.thalesgroup.com/encryption/data-protection-on-demand,,High-assurance cloud and hardware security modules integrating NIST-standardized PQC algorithms for key management and PKI.,Trusted Vendor,Verified,2026-02-24,"prepare,migrate,launch",aerospace-pqc;healthcare-pqc;hsm-pqc;secure-boot-pqc,VND-041,thales-research,
