software_name,category_id,category_name,infrastructure_layer,pqc_support,pqc_capability_description,license_type,license,latest_version,release_date,fips_validated,pqc_migration_priority,primary_platforms,target_industries,authoritative_source,repository_url,product_brief,source_type,verification_status,last_verified_date,migration_phases,learning_modules,vendor_id,trusted_source_id,evidence_flags
BTQ Bitcoin Quantum,CSC-058,Blockchain & DLT Protocols,"Application, Network",Yes (ML-DSA),First quantum-safe fork of Bitcoin. Testnet replaces ECDSA with NIST-standardized ML-DSA signatures to protect against quantum threats. Increased block size to 64 MiB to accommodate larger PQC signatures (38-72x larger than ECDSA). Full transaction lifecycle with quantum-resistant cryptography. Protects ~6.26M BTC in addresses with exposed public keys against Harvest Now Decrypt Later attacks.,Open Source/Commercial,Open Source,"V3 (Testnet), v0.3.0 (BIP 360 implementation)","2026-01-12 (Testnet launch), 2026-03-19 (BIP 360 deployment)",No,High,Bitcoin Network (Testnet),"Cryptocurrency, Finance, Digital Assets",https://www.prnewswire.com/news-releases/btq-technologies-implements-bip-360-quantum-resistant-bitcoin-transactions-testnet-302585981.html,,"The first quantum-safe fork of Bitcoin, serving as a live testnet environment and liquidity bridge for quantum-threatened digital assets.",Trusted Vendor,Verified,2026-02-13,migrate,digital-assets,VND-089,ietf,no-cert-backing
Hitachi DoMobile,CSC-036,Remote Access and VDI Software,Application,Yes (ML-KEM FIPS 203),Japan's first remote access system with built-in post-quantum cryptographic protection powered by 01 Quantum. Implements NIST FIPS 203 (ML-KEM) to protect against Harvest Now Decrypt Later attacks. Free upgrade for existing customers. Serving ~7000 companies and 36000 users primarily in finance sector. In production since 2002.,Commercial,"Proprietary (implied by ""Copyright © 2026 - 01 Communique Laboratory Inc. All Rights Reserved"")",Ver.5,2026-01-15,No,Critical,Windows Mobile,"Enterprise, IT Support (implied by ""Remote IT Support"" and ""Agent Connect"")",https://www.01com.com/news-media/hitachi-solutions-create-introduces-worlds-first-remote-access-system,https://www.hitachi-solutions-create.co.jp/domobile/,First commercial remote access product in Japan with production-ready NIST-standardized PQC. Demonstrates enterprise readiness for PQC in remote access scenarios.,Trusted Vendor,Verified,2026-02-13,migrate,vpn-ssh-pqc,VND-135,secom,no-cert-backing
Project Eleven Solana PQC,CSC-058,Blockchain & DLT Protocols,Application,Yes (ML-DSA),"Deployed a production-grade registry (""yellowpages"") for Bitcoin allowing PQC key generation linked to existing addresses. Built and open-sourced the first post-quantum testnet for Solana, replacing standard EdDSA with NIST-standardized ML-DSA. Demonstrates practical end-to-end quantum-resistant transactions.",Open Source/Commercial,Open Source,Testnet,2025-12-16,No,Critical,"Solana Network, Bitcoin Network","Cryptocurrency, Digital Assets, Finance",https://www.projecteleven.com/subscribe,,Post-quantum cryptographic infrastructure and testnet for securing digital assets on Solana and Bitcoin.,Trusted Vendor,Verified,2026-02-13,migrate,digital-assets;migration-program,VND-091,ietf,no-cert-backing
SEALSQ Quantum Shield,CSC-034,Hardware Security and Semiconductors,Hardware,Yes (ML-KEM; ML-DSA),"Integrates ML-KEM (CRYSTALS-Kyber) and ML-DSA (CRYSTALS-Dilithium) directly in silicon. Provides 10x performance gains, stronger side-channel resistance, and advanced tamper protection. Built as an open hardware platform with support for custom firmware and hybrid cryptography migration.",Proprietary,Commercial,QS7001,2025-11-15 (Planned official launch mid-November 2025),"Yes, FIPS 140-3 (Company achieved highest levels including FIPS 140-3; specific chip validation status not explicitly detailed beyond company certification).",Critical,"Defense & Aerospace, Healthcare & Infrastructure, Energy & Smart Grid, IoT & Edge, Automotive, Industrial Automation.","Defense, Healthcare, Energy, IoT, Automotive, Industrial Automation, Telecommunications, Logistics, Medical, Luxury.",https://markets.financialcontent.com/wral/article/tokenring-2025-10-8-sealsq-unveils-quantum-shield-qs7001-and-wisesat-30-pqc-a-new-era-of-quantum-resistant-security-dawns-for-ai-and-space,,Post-quantum semiconductor chips with embedded quantum-resistant cryptography. First deployments in U.S. government and critical infrastructure.,Trusted Vendor,Verified,2026-02-13,"prepare,launch",aerospace-pqc;iot-ot-pqc,VND-056,ietf,no-cert-backing
Forward Edge-AI Isidore Quantum,CSC-033,Network Security Software,"Network, Hardware",Unknown (Yes (ML-KEM AES-256 GCM)),"Delivers quantum-resilient encryption using CNSA 2.0-compliant algorithms including AES-256 GCM and ML-KEM (CRYSTALS-Kyber). Supports Dilithium for signatures. Features autonomous on-orbit rekeying, self-healing security, and integrated Quantum Random Number Generator (QRNG). Validated with U.S. Space Force, NASA, and NSA.",Commercial,Proprietary,Current,2026-09-15 (Table of contents date) / Q3 2026 - Q4 2026 (Availability for variants),"Yes, FIPS 140-3 (Level 3) compliant.",Critical,"Space systems (satellites, launch systems, ground networks), TT&C links, inter-satellite links, hybrid space-terrestrial networks.","Space Systems, Defense, Government (U.S. Space Force, NASA, NSA), Commercial Satellite Operators.",https://forwardedge.ai/isidore/,,Hardware-based quantum-resistant encryption for high-security environments. Deployed across U.S. military branches and SpaceX missions.,Unverified Vendor,Needs Verification,2026-02-13,"test,migrate",5g-security;aerospace-pqc;crypto-dev-apis;network-security-pqc;vpn-ssh-pqc,VND-140,nist-csrc,
QuSecure QuProtect R3,CSC-025,Cryptographic Agility Frameworks,"Cloud, Network, Application, Security Stack",Yes (with details),"Production-ready, end-to-end PQC software-based solution providing quantum-resilience using quantum secure channels. Supports NIST-approved PQC algorithms. Enables transitions to post-quantum algorithms without code changes or system downtime. Designed for national security, network, IoT, edge devices, and satellite communications.",Commercial,Proprietary,R3,2023-01-05 (Announcement date for QuProtect R3 launch context),No,Critical,"Cloud, on-premises, hybrid, air-gapped environments; any device.","Telecom, Finance, Defense, Healthcare, Space/Satellite, IT/Data Enterprises, Critical Infrastructure, Government",https://www.qusecure.com/qusecure-launches-quprotect-r3/,,"Fully integrated, production-ready platform for cryptographic discovery, remediation, and reporting with post-quantum capabilities.",Trusted Vendor,Verified,2026-03-30,"assess,plan,rampup",arch-quantum-impact;crypto-agility;exec-quantum-impact;pqc-governance,VND-054,qusecure,no-cert-backing
SandboxAQ AQtive Guard,CSC-049,Cryptographic Discovery Platforms,"Cloud, Security Stack",Yes (with details),"Provides cryptographic agility and future-proofing via remediation of out-of-policy algorithms. Supports NIST-approved PQC standards HQC (Hamming Quasi-Cyclic) for key encapsulation and SPHINCS+ for signatures, co-invented by SandboxAQ team members. Designed to address vulnerabilities without re-architecting systems.",Commercial,Proprietary,Current,"2025-03-27 (Press release date regarding HQC selection; product availability is ""preview"")",No,High,"Enterprise DevOps environments, centralized database with GraphQL API integration","Enterprises, Government agencies",http://www.sandboxaq.com,,Enables encryption remediation and enforcement while continuously optimizing cryptography across organizations.,Trusted Vendor,Verified,2026-02-21,"assess,plan,rampup",aerospace-pqc;arch-quantum-impact;compliance-strategy;crypto-agility;data-asset-sensitivity;energy-utilities-pqc;exec-quantum-impact;migration-program;network-security-pqc;ops-quantum-impact;platform-eng-pqc;pqc-business-case;pqc-governance;pqc-risk-management;quantum-threats,VND-036,sandboxaq,no-cert-backing
01 Quantum IronCAP,CSC-001,Cryptographic Libraries,Application,Yes (with details),"Combines NIST-approved PQC algorithms with patent-protected quantum-safe technology. Supports email/file encryption, digital signatures, blockchain security, remote access/VPN, password management, credit card security, cloud storage, and website security. Designed for seamless integration via OpenSSL, PKCS#11, and OpenPGP standards.",Proprietary,Proprietary,Current,2026-01,No,High,Cross-platform,"Blockchain, IoT, Data Storage, Remote Access, Email Security, Financial Transactions, Cloud Storage, Website Security",https://www.ironcap.ca/ironcap-toolkits/,,Post-quantum cryptography toolkits enabling vendors to secure vertical applications against classical and quantum attacks.,Trusted Vendor,Verified,2026-03-30,"prepare,test,migrate",ai-security-pqc;dev-quantum-impact;digital-assets;hybrid-crypto;tls-basics,VND-052,cmvp,proprietary-mceliece-variant; no-cert-backing
Bouncy Castle C# .NET,CSC-001,Cryptographic Libraries,"Application, Security Stack",Yes (ML-KEM ML-DSA SLH-DSA HQC FN-DSA),"Includes implementations of NIST Post-Quantum Cryptography Standardization algorithms: ML-DSA, ML-KEM, SLH-DSA, Falcon, Classic McEliece, FrodoKEM, NTRU, NTRU Prime, Picnic, Saber, and BIKE. All are considered EXPERIMENTAL and subject to change or removal.",Open Source,"MIT (based on MIT X Consortium license); includes modified Bzip2 under Apache Software License, Version 2.0",2.6.2,2026-03-01,No (Source tree is not the FIPS version; FIPS version available separately),Critical,".NET, .NET Core",All industries,https://github.com/bcgit/bc-csharp,https://github.com/bcgit/bc-csharp,A .NET implementation of cryptographic algorithms and protocols developed by the Legion of the Bouncy Castle.,Trusted Vendor,Verified,2026-03-30,"prepare,test,migrate",dev-quantum-impact;hybrid-crypto;tls-basics,VND-025,bouncy-castle,fips-140-2-not-140-3
Bouncy Castle Java,CSC-001,Cryptographic Libraries,"Application, Security Stack",Yes (ML-KEM ML-DSA SLH-DSA HQC),"Comprehensive PQC implementation supporting ML-KEM, ML-DSA, SLH-DSA, and HQC (Hamming Quasi-Cyclic). Provides quantum-resistant key encapsulation and digital signatures through JCE/JCA provider. Supports hybrid classical/PQC modes for gradual migration.",Open Source/Commercial,"MIT (based on MIT X Consortium license); Apache Software License, Version 2.0 (for modified BZIP2 library in OpenPGP)",1.83,2025-11,"No (Document states: ""this source tree is not the FIPS version of the APIs"").",Critical,"Java (JDK 1.1 to JDK 21+), J2ME",All industries,https://github.com/bcgit/bc-java,https://github.com/bcgit/bc-java,Comprehensive Java implementation of cryptographic algorithms. Supports JCE/JCA provider lightweight API PGP S/MIME DTLS TLS OCSP TSP CMP and certificate generation.,Trusted Vendor,Verified,2026-03-30,"prepare,test,migrate",crypto-dev-apis;dev-quantum-impact;email-signing;hybrid-crypto;tls-basics,VND-025,bouncy-castle,
Bouncy Castle Java LTS,CSC-001,Cryptographic Libraries,"Application, Security Stack",Yes (ML-DSA composite signatures),"Long-term support release with ML-DSA composite signatures, enabling hybrid quantum-classical signature schemes. Allows organizations to use both traditional (RSA/ECDSA) and post-quantum signatures simultaneously for defense-in-depth.",Open Source/Commercial,"MIT (based on MIT X Consortium license); Apache Software License, Version 2.0 (for BZIP2 in OpenPGP library)",2.73.10,2025-09-23,"No (Document states: ""this source tree is not the FIPS version of the APIs"").",Critical,"Java (JDK 1.1 to JDK 21+), J2ME",All industries,https://github.com/bcgit/bc-java,https://github.com/bcgit/bc-java,A Java implementation of cryptographic algorithms developed by the Legion of the Bouncy Castle.,Trusted Vendor,Verified,2026-03-30,"prepare,test,migrate",dev-quantum-impact;hybrid-crypto;tls-basics,VND-025,bouncy-castle,
OpenSSL,CSC-001,Cryptographic Libraries,"Application, Security Stack",No,"Full support for NIST-standardized PQC algorithms including ML-KEM (Module-Lattice-Based Key-Encapsulation Mechanism) for key exchange, ML-DSA (Module-Lattice-Based Digital Signature Algorithm) for signatures, and SLH-DSA (Stateless Hash-Based Digital Signature Algorithm). Enables quantum-safe TLS 1.3 connections with hybrid mode support.",Open Source,Apache-2.0,3.6,2026-01-27,"Yes, includes a cryptographic module validated to conform with FIPS standards.",Critical,"UNIX-like platforms, Android, Windows, DOS (with DJGPP), OpenVMS",All industries,https://www.openssl.org,https://github.com/openssl/openssl,Robust commercial-grade TLS/SSL and crypto library. Implements TLS 1.3 DTLS 1.3 and QUIC protocols. Reference implementation for cryptographic operations used by majority of HTTPS websites.,Community/Commercial,Verified,2026-02-13,"prepare,test,migrate",code-signing;compliance-strategy;crypto-agility;crypto-dev-apis;dev-quantum-impact;email-signing;entropy-randomness;hybrid-crypto;os-pqc;pqc-101;quantum-threats;tls-basics,VND-049,openssl-project,
Google Tink,CSC-001,Cryptographic Libraries,"Application, Security Stack",No,"Multi-language library (C++, Go, Java). Experimental PQC access available in C++. HPKE (Hybrid Public Key Encryption) support is shipping in stable releases. NIST PQC algorithm integration (ML-KEM, ML-DSA) in progress but not yet in stable releases. Used in Google infrastructure and Cloud KMS. Project restructured into language-specific repos (tink-java, tink-go, etc.).",Open Source,Apache 2.0,1.20.0,2024-06-27 (Last update of documentation),Yes (via BoringCrypto),Critical,"Java, GCP Ubuntu, MacOS",All industries,https://developers.google.com/tink,https://github.com/tink-crypto/tink-java,"A multilingual, cross-platform open-source cryptographic library providing secure and easy-to-use APIs.",Community/Commercial,Verified,2026-03-30,"prepare,test,migrate",crypto-dev-apis;dev-quantum-impact;hybrid-crypto;tls-basics,VND-018,google,
Botan,CSC-001,Cryptographic Libraries,Application,Yes (ML-KEM ML-DSA SLH-DSA LMS XMSS McEliece FrodoKEM),"Supports hybrid post-quantum key exchange in TLS 1.3 using ML-KEM or FrodoKEM. Includes post-quantum signature schemes: ML-DSA (Dilithium), SLH-DSA (SPHINCS+), HSS/LMS, XMSS. Includes post-quantum key encapsulation schemes: ML-KEM (Kyber), FrodoKEM, Classic McEliece.",Open Source,BSD-2-Clause (Simplified BSD),3.10.0,2025-11-06,No,High,"Fedora, Debian, Arch, Homebrew; C++, C, Python APIs available.",All industries,https://github.com/randombit/botan,https://github.com/randombit/botan,"A cryptography library offering tools for TLSv1.3, X.509 PKI, modern AEAD ciphers, and post-quantum cryptography.",Open Source Foundation,Verified,2026-03-30,"prepare,test,migrate",crypto-dev-apis;dev-quantum-impact;hybrid-crypto;tls-basics,VND-069,oqs-project,
SafeLogic CryptoComply,CSC-001,Cryptographic Libraries,Application,Yes (ML-KEM ML-DSA SLH-DSA Hybrid),"Provides a drop-in replacement for OpenSSL 3.x based TLS 1.3. Features Pure PQ mode using NIST standard ML-KEM (FIPS 203), Hybrid mode combining classical and PQC, and Legacy mode. Implementation is CAVP-certified and claims to be 20% faster than PKI.",Commercial,Proprietary,Go v4.0,2026-01,Yes (FIPS 140-3 validated algorithms; CAVP-certified ML-KEM implementation),High,"Go, Java, Mobile, .NET (Core); Multiple platforms mentioned generally.","Communications, Cybersecurity, Financial Services, Healthcare, Public Sector, Technology, Government, Military",https://csrc.nist.gov/projects/cryptographic-algorithm-validation-program/details?product=18289,,"Drop-in, commercial-grade, quantum-resistant TLS solution leveraging CAVP-certified ML-KEM.",Trusted Vendor,Verified,2026-03-30,"prepare,test,migrate",aerospace-pqc;dev-quantum-impact;healthcare-pqc;hybrid-crypto;tls-basics,VND-034,nist-csrc,
SAP Cryptographic Library,CSC-001,Cryptographic Libraries,Application,Yes (ML-KEM ML-DSA),"Version 8.6 enables quantum-safe TLS 1.3 handshake using hybrid ECDHE-MLKEM key agreement based on X25519MLKEM768. ML-KEM is a standardized FIPS-203 algorithm for key encapsulation, preventing session key decryption by quantum computers.",Proprietary,Commercial,8.6 (specifically CommonCryptoLib 8.6.2 mentioned in release note),2025-12-12,"Yes, FIPS 140-3 certified (Certificate #5093) for the FIPS crypto kernel module.",High,"SAP NetWeaver Application Server for ABAP, SAP HANA","US public sector agencies, healthcare, financial industries, Enterprise",https://community.sap.com/t5/technology-blogs-by-sap/new-version-8-6-of-the-sap-cryptographic-library-with-quantum-safe/ba-p/14280039,,"Enables applications like SAP S/4 HANA to support security protocols such as TLS, SNC, SSF, and X.509 with quantum-safe cryptography.",Trusted Vendor,Verified,2026-03-25,"prepare,test,migrate",crypto-dev-apis;dev-quantum-impact;hybrid-crypto;tls-basics,VND-033,sap,
PQShield PQSDK,CSC-001,Cryptographic Libraries,Application,Yes (ML-KEM ML-DSA Falcon),"Provides implementations of PQC key agreement and digital signature algorithms via PQCryptoLib integrated into OpenSSL (v3.2.0+) and mbedTLS (v3.2.1). Supports hybrid modes (classical plus PQC). Enables post-quantum TLS 1.3 and X.509 PKI support. Algorithms include Falcon, ML-KEM, and ML-DSA.",Commercial,Commercial,R24.3.1,2024-07-12,"No (References FIPS-203 and FIPS-204 standards for algorithms, but no validation status mentioned)",Critical,"Linux (x86_64 and ARM64), macOS, MS Windows",All industries,https://pqshield.com/products/pqc-sdk/,,PQShield PQCryptoLib-SDK development kit (also marketed as PQSDK). High-assurance post-quantum cryptography SDK for enterprise and embedded security. Note: product is formally named PQCryptoLib-SDK.,Trusted Vendor,Verified,2026-03-30,"prepare,test,migrate",dev-quantum-impact;hybrid-crypto;tls-basics,VND-030,pqshield,
Go stdlib crypto/mlkem,CSC-001,Cryptographic Libraries,Application,Yes (ML-KEM-768 and ML-KEM-1024),"Implements ML-KEM (formerly Kyber) per NIST FIPS 203. Supports parameter sets ML-KEM-768 and ML-KEM-1024 via DecapsulationKey and EncapsulationKey types. Provides functions for key generation, encapsulation, and decapsulate operations. Includes a testing package (mlkemtest) for derandomized encapsulation.",Open Source,BSD-3-Clause,go1.26.1,2026-03-06,"No (Implements algorithm specified in NIST FIPS 203, but no validation status stated)",Critical,Go programming language environments,All industries,https://cs.opensource.google/go/go,https://github.com/golang/go/tree/master/src/crypto/mlkem,A standard library package implementing the quantum-resistant ML-KEM key encapsulation method as specified in NIST FIPS 203.,Open Source Foundation,Verified,2026-02-13,"prepare,test,migrate",crypto-dev-apis;dev-quantum-impact;hybrid-crypto;tls-basics,VND-018,nist-csrc,
RustCrypto ml-kem,CSC-001,Cryptographic Libraries,Application,Yes (ML-KEM/FIPS 203),"Implements ML-KEM (formerly Kyber), a post-quantum secure key encapsulation mechanism standardized by NIST in FIPS 203. Supports three security levels: MlKem512 (128-bit), MlKem768 (192-bit), and MlKem1024 (256-bit). Implementation is pure Rust, version 0.2.3. Security warning states it has never been independently audited.",Open Source,"Apache License, Version 2.0 OR MIT license",0.2.3,2025-10,"No (Implements algorithm described in FIPS 203, but implementation is not stated as validated)",High,"aarch64-apple-darwin, aarch64-unknown-linux-gnu, i686-pc-windows-msvc, x86_64-pc-windows-msvc, x86_64-unknown-linux-gnu",All industries,https://github.com/RustCrypto/KEMs,https://github.com/RustCrypto/KEMs/tree/master/ml-kem,Pure Rust implementation of the Module-Lattice-Based Key-Encapsulation Mechanism (ML-KEM) standard.,Open Source Community,Verified,2026-03-30,"prepare,test,migrate",dev-quantum-impact;hybrid-crypto;research-quantum-impact;tls-basics,VND-050,nist-csrc,no-cert-backing; v0.3.0 is RC only
RustCrypto ml-dsa,CSC-001,Cryptographic Libraries,Application,Yes (ML-DSA / CRYSTALS-Dilithium),"Implements ML-DSA (formerly CRYSTALS-Dilithium) per FIPS 204 final. Supports parameter sets MlDsa44 (Category 2), MlDsa65 (Category 3), and MlDsa87 (Category 5). Implementation is pure Rust, supports `no_std`, and includes key generation, signing, and verification. Warning: Never independently audited; use at own risk.",Open Source,Apache-2.0 OR MIT,0.0.4,2025,No (Implementation describes FIPS 204 but is not stated as validated; explicitly warns it has never been independently audited),High,"i686-pc-windows-msvc, i686-unknown-linux-gnu, x86_64-apple-darwin, x86_64-pc-windows-msvc, x86_64-unknown-linux-gnu; supports bare-metal and WebAssembly.",All industries,https://github.com/RustCrypto/signatures (Repository); https://docs.rs/ml-dsa (Documentation),https://github.com/RustCrypto/signatures/tree/master/ml-dsa,Pure Rust implementation of the Module-Lattice-Based Digital Signature Standard (ML-DSA) as described in FIPS 204.,Open Source Community,Verified,2026-02-13,"prepare,test,migrate",dev-quantum-impact;hybrid-crypto;research-quantum-impact;tls-basics,VND-050,nist-csrc,
RustCrypto slh-dsa,CSC-001,Cryptographic Libraries,Application,Yes (SLH-DSA/SPHINCS+ implemented per FIPS-205),"Implements Stateless Hash-based Digital Signature Algorithm (SLH-DSA) based on SPHINCS+, finalized in NIST FIPS-205. Supports 12 parameter sets (SHA2 and SHAKE variants at L1, L3, L5 security). Signatures range from 7KB to 50KB. Implementation is not independently audited; requires Rust 1.75+.",Open Source,Apache-2.0 OR MIT,0.1.0,2025,"No (Implementation based on FIPS-205 standard, but not stated as validated; warning notes lack of independent audit)",High,"i686-pc-windows-msvc, i686-unknown-linux-gnu, x86_64-apple-darwin, x86_64-pc-windows-msvc, x86_64-unknown-linux-gnu; supports `no_std` for bare-metal/WebAssembly.",All industries,"https://github.com/RustCrypto/signatures (Repository), https://docs.rs/slh-dsa (Documentation)",https://github.com/RustCrypto/signatures/tree/master/slh-dsa,Pure Rust implementation of the SLH-DSA (SPHINCS+) signature scheme based on FIPS-205.,Open Source Community,Verified,2026-02-13,"prepare,test,migrate",dev-quantum-impact;hybrid-crypto;research-quantum-impact;tls-basics,VND-050,nist-csrc,
pqcrypto,CSC-001,Cryptographic Libraries,Application,Yes (bindings to NIST competition algorithms via PQClean),"Provides Rust bindings to C implementations of cryptographic algorithms from the NIST competition, generated from the PQClean project. Supports variants controlled by `implementations.yaml`. Maturity is indicated by repository activity and documentation on docs.rs.",Open Source,Apache-2.0/MIT,0.18.1,2026-02-27,No,Medium,Rust (Language),All industries,https://github.com/rustpq/pqcrypto,https://github.com/rustpq/pqcrypto,Rust bindings to C implementations of NIST post-quantum cryptographic algorithms based on PQClean.,Open Source Community,Verified,2026-02-13,"prepare,test,migrate",dev-quantum-impact;hybrid-crypto;research-quantum-impact;tls-basics,VND-080,oqs-project,
liboqs-rust (oqs crate),CSC-001,Cryptographic Libraries,Application,Yes (Supports KEMs and Signature schemes including NIST standardization candidates),"Provides Rust wrappers for liboqs, a C library for quantum-resistant cryptography. Supports KEMs (BIKE, Classic McEliece, FrodoKEM, HQC, Kyber, ML-KEM, NTRU Prime) and Signatures (Cross, Dilithium, Falcon, Mayo, ML-DSA, SPHINCS+, UOV). Designed for prototyping; recommends hybrid cryptography alongside traditional algorithms.",Open Source,"Apache-2.0, MIT (Dual-licensed)",0.10.1 (for `oqs` crate); 0.9.0+liboqs-0.9.0 (versioning scheme mentioned),2026-03-01 (Last Updated timestamp in document),No,High,Rust environments; supports `no_std` and system-provided or vendored builds,All industries,https://github.com/open-quantum-safe/liboqs-rust,https://github.com/open-quantum-safe/liboqs-rust,Rust bindings for the Open Quantum Safe C library providing quantum-resistant cryptographic algorithms.,Open Source Foundation,Verified,2026-02-13,"prepare,test,migrate",crypto-dev-apis;dev-quantum-impact;hybrid-crypto;research-quantum-impact;tls-basics,VND-048,oqs-project,
mlkem-native,CSC-001,Cryptographic Libraries,Application,Yes (ML-KEM / FIPS 203),"Implementation of ML-KEM (FIPS 203) with support for security levels 512, 768, and 1024. Includes formal verification (CBMC, HOL-Light) for memory safety, type safety, and constant-time execution on AArch64 and x86_64. Supports native backends for Arm, Intel/AMD, and RISC-V. Used as a default implementation in libOQS, AWS-LC, and rustls.",Open Source,"Apache-2.0, ISC, MIT (Multiple licenses listed in badges; NOASSERTION in metadata)",1.0.0,2026-03-04,"No (Implements FIPS 203 standard, but validation status not stated)",High,"Arm (64-bit Neon, 32-bit Helium/MVE), Intel/AMD (64-bit AVX2), RISC-V (64-bit RVV); Ubuntu mentioned for quickstart.",All industries,https://github.com/pq-code-package/mlkem-native,https://github.com/pq-code-package/mlkem-native,"Secure, fast, and portable C90 implementation of ML-KEM / FIPS 203.",Open Source Foundation,Verified,2026-02-13,"prepare,test,migrate",dev-quantum-impact;hybrid-crypto;research-quantum-impact;tls-basics,VND-079,pqca,
