software_name,category_id,category_name,infrastructure_layer,pqc_support,pqc_capability_description,license_type,license,latest_version,release_date,fips_validated,pqc_migration_priority,primary_platforms,target_industries,authoritative_source,repository_url,product_brief,source_type,verification_status,last_verified_date,migration_phases,learning_modules,vendor_id,trusted_source_id,evidence_flags
Suricata IDS/IPS,CSC-018,Cryptographic Protocol Analyzers,"Security Stack, Network",No,"Suricata is an open-source network threat detection engine supporting IDS, IPS, and NSM. PQC relevance is for TLS fingerprinting and detecting PQC cipher suites in network traffic. Suricata 8.x development includes detection rules for ML-KEM hybrid TLS handshakes and malformed PQC packets. Used by SOCs to monitor the PQC transition in enterprise networks.",Open Source,GPL-2.0,8.0.3,2026-03-06 (Last Updated date provided),No,Medium,Linux BSD,Technology Finance Government Defense,https://suricata.io,https://github.com/OISF/suricata,Open-source IDS/IPS. PQC role: detection rules for ML-KEM hybrid TLS handshakes in network traffic. Used by SOCs to monitor enterprise PQC migration.,Open Source Foundation,Verified,2026-03-30,"assess,plan",aerospace-pqc;arch-quantum-impact;migration-program;network-security-pqc;research-quantum-impact,VND-204,microsoft,
Zeek Network Analysis Framework,CSC-018,Cryptographic Protocol Analyzers,"Security Stack, Network",No,"Zeek (formerly Bro) is a network analysis framework used for TLS/SSL inspection, DNS monitoring, and protocol analysis. Zeek 6.x includes TLS fingerprinting for ML-KEM hybrid cipher suites. SOC teams use Zeek to detect PQC algorithm negotiation in TLS handshakes and monitor migration progress. Does not implement PQC algorithms itself.",Open Source,BSD license,8.1,2026-03-06 (Last Updated date),No,Medium,Linux BSD macOS,"Major companies, educational institutions, scientific institutions",https://www.zeek.org,https://github.com/zeek/zeek,Network analysis framework for TLS/protocol inspection. PQC role: detect ML-KEM hybrid cipher suites in TLS handshakes. Monitors enterprise PQC migration progress.,Open Source Foundation,Verified,2026-03-30,"assess,plan",aerospace-pqc;arch-quantum-impact;migration-program;network-security-pqc;research-quantum-impact,VND-203,microsoft,
Tenable Nessus Professional,CSC-018,Cryptographic Protocol Analyzers,Security Stack,No,"Tenable Nessus is the world's most widely deployed vulnerability scanner. PQC relevance: Nessus includes plugins for TLS cipher suite enumeration, weak algorithm detection, and certificate analysis. December 2025 release added dedicated PQC Inventory Support with TLS/SSH PQC detection plugins. Tenable One (enterprise) includes cryptographic inventory capabilities for PQC migration readiness assessment.",Commercial,"Proprietary (Pricing listed: 1 Year - $4,790; 2 Years - $9,330.95; 3 Years - $13,637.54)",10.9,2025-01,"No (Document mentions ""Configuration, compliance and security audits"" and lists regulations like FISMA, but does not explicitly state FIPS 140-2 or 140-3 validation status for the product).",High,"Raspberry Pi, Windows, Linux, macOS (implied by ""Deploy on any platform"" and ""Use anywhere"", though specific OS names are not listed in the text provided).","Educational institutions, Energy, Banks and financial services, Healthcare, Retail, Public Sector, State / Local / Education, US federal.",https://www.tenable.com/products/nessus,,The industry's most trusted vulnerability assessment solution to expose and close weaknesses across your attack surface.,Trusted Vendor,Verified,2026-03-30,assess,aerospace-pqc;arch-quantum-impact;exec-quantum-impact;healthcare-pqc;migration-program;network-security-pqc;ops-quantum-impact;pqc-risk-management;research-quantum-impact,VND-185,cmvp,
Rapid7 InsightVM,CSC-018,Cryptographic Protocol Analyzers,Security Stack,No,Rapid7 InsightVM is a vulnerability management and risk scoring platform. InsightVM includes TLS/SSL configuration assessment and certificate management visibility. The InsightVM Quantum Readiness dashboard (announced 2025) maps cryptographic dependencies across the enterprise. InsightIDR (SIEM component) supports PQC algorithm detection in network logs.,Commercial,Proprietary (Commercial),,,No,High,"Microsoft Windows, Linux; Cloud and hybrid environments; On-premises (Scan Engines, Security Console).","Financial Services, Enterprise (general), Government (implied by compliance standards like HIPAA/CIS/PCI DSS)",https://www.rapid7.com/try/insight/,,"Vulnerability management solution providing attack surface visibility, AI-driven risk prioritization, and remediation workflows.",Trusted Vendor,Partially Verified,2026-03-25,assess,arch-quantum-impact;crypto-dev-apis;exec-quantum-impact;healthcare-pqc;migration-program;network-security-pqc;ops-quantum-impact;pqc-risk-management;research-quantum-impact,VND-165,cmvp,
Qualys Cloud Platform,CSC-018,Cryptographic Protocol Analyzers,"Security Stack, Cloud",No,"Qualys Cloud Platform provides continuous security monitoring, vulnerability management, and compliance assessment. Qualys SSL Labs (free) and Qualys VM Enterprise include TLS cipher suite grading, certificate inventory, and weak algorithm detection. Useful for PQC migration baseline assessment. Qualys has not published PQC-specific detection capabilities as of Q1 2026.",Commercial,Proprietary (Subscription-based),,,No,High,"On-prem, Cloud, Internet-facing assets; integrates with ServiceNow, JIRA, BMC Helix, Active Directory.","Enterprise (Forbes Global 100, Fortune 100), Finance (Banco PAN), Healthcare/Services (Cintas)",https://www.qualys.com/apps/vulnerability-management-detection-response/,,"Unified risk-based vulnerability management, detection, and response platform with asset discovery and patching.",Trusted Vendor,Partially Verified,2026-03-25,assess,arch-quantum-impact;healthcare-pqc;migration-program;ops-quantum-impact;pqc-risk-management;research-quantum-impact,VND-164,cmvp,
AWS Identity and Access Management (IAM),CSC-042,Identity & Access Management (IAM),"Security Stack, Cloud",No,AWS IAM is the access control service for all AWS resources. AWS has enabled ML-KEM hybrid TLS 1.3 on the AWS API endpoints and console. IAM policy signing and STS token signing (SigV4) use classical HMAC-SHA256. AWS has not announced ML-DSA migration for SigV4 or IAM credentials. AWS Nitro Enclaves and KMS are separate PQC migration targets.,Proprietary,Commercial (AWS),,,Yes (FedRAMP High / FIPS endpoints),Critical,AWS (Amazon Web Services),"Enterprise (implied by ""workload and workforce access"", ""agility and innovation"")",https://aws.amazon.com/iam/,,AWS access control service. ML-KEM hybrid TLS active on AWS API endpoints. SigV4 token signing remains classical — PQC migration for credentials pending.,Trusted Vendor,Partially Verified,2026-03-04,"assess,plan",compliance-strategy;crypto-dev-apis;healthcare-pqc;iam-pqc;kms-pqc;migration-program,VND-001,amazon-aws,
CrowdStrike Falcon,CSC-049,Cryptographic Discovery Platforms,Security Stack,No,CrowdStrike Falcon is a leading EDR/XDR platform. Falcon sensor communicates with the Falcon Cloud via TLS 1.3. CrowdStrike has announced PQC readiness for sensor-to-cloud communications as part of its cryptographic agility initiative. Falcon Exposure Management includes cryptographic inventory capabilities. No GA PQC sensor release as of Q1 2026.,Commercial,Proprietary,,,No,High,"Every major operating system (implied by ""protects every major operating system"")","Enterprise, Government (mentioned via ""Fal.Con Gov 2026"" event)",https://www.crowdstrike.com/products/endpoint-security/,,Market-leading EDR/XDR. PQC sensor transport roadmap announced. Falcon Exposure Management provides cryptographic inventory for PQC migration planning.,Trusted Vendor,Needs Verification,2026-03-04,assess,aerospace-pqc;arch-quantum-impact;exec-quantum-impact;healthcare-pqc;migration-program;network-security-pqc;ops-quantum-impact;pqc-risk-management,VND-161,nist-csrc,
Palo Alto Cortex XDR,CSC-049,Cryptographic Discovery Platforms,"Security Stack, Cloud (implied by ""Cloud Delivered Security Services"" and ""Cortex Platform""), Application (Endpoint)",No,"Palo Alto Cortex XDR is an extended detection and response platform integrating endpoint, network, and cloud telemetry. Agent-to-cloud communications use TLS 1.3. PQC roadmap aligned with Palo Alto's quantum-safe initiative (separate from PAN-OS ML-KEM support). Cortex XSIAM includes cryptographic exposure detection features.",Commercial,Proprietary,,,No,High,"Endpoints (Windows, macOS, Linux implied by ""endpoint"" context but not explicitly listed); Cloud; Network; Identity; Email.","Commercial Businesses, Enterprise, Healthcare (Asante Health), Government/Public Sector (North Dakota IT), Automotive/Marketplace (Kavak), Education (Wits University), Banking (Glacier Bancorp).",https://www.paloaltonetworks.com/cortex/cortex-xdr,,XDR platform with endpoint/network/cloud telemetry. PQC transport roadmap aligned with Palo Alto quantum-safe initiative. Cryptographic exposure detection in Cortex XSIAM.,Trusted Vendor,Needs Verification,2026-03-04,assess,arch-quantum-impact;exec-quantum-impact;healthcare-pqc;migration-program;network-security-pqc;ops-quantum-impact;pqc-risk-management,VND-031,palo-alto,
Citrix Virtual Apps and Desktops,CSC-036,Remote Access and VDI Software,"Security Stack, Cloud, Application",No,Citrix Virtual Apps and Desktops (CVAD) delivers virtualized applications and desktops over ICA/HDX protocol. All client-server communications use TLS 1.3. PQC migration requires Citrix Gateway (ADC) ML-KEM TLS support and ICA protocol channel encryption upgrade. Citrix has not published a specific PQC roadmap as of Q1 2026.,Commercial,"Proprietary (Managed by Citrix Licensing Activation Service; ""Manage licenses"" mentioned)",2407,2024-07,No,High,"Microsoft Azure, Google Cloud Platform, AWS, on-premises infrastructure; Windows, Linux, macOS, Android, visionOS (via Workspace app).","Healthcare, Financial services, Manufacturing, Education, Government, Retail.",https://www.citrix.com/products/citrix-virtual-apps-and-desktops/,,Enterprise-grade virtual apps and desktops delivering secure work experiences on any device via hybrid infrastructure.,Trusted Vendor,Needs Verification,2026-03-04,assess,healthcare-pqc;migration-program;tls-basics;vpn-ssh-pqc,VND-009,cmvp,
VMware Horizon,CSC-036,Remote Access and VDI Software,"Security Stack, Cloud, Application",No,VMware Horizon (now Broadcom) provides VDI and DaaS using the Blast Extreme protocol over HTTPS/WebSocket. TLS 1.3 is used for all management and display protocol connections. PQC migration requires Unified Access Gateway (UAG) ML-KEM support and Blast protocol encryption upgrade. No PQC timeline published under Broadcom ownership.,Commercial,Proprietary,Horizon 8,2024-06,No,High,"On-premises, private clouds, public cloud environments; supports Windows management and Mac device management.","Education, Federal government, Financial services, Healthcare, Public sector, Retail",https://www.vmware.com/products/horizon.html,,Virtual desktop infrastructure (VDI) and app solution providing secure access to full desktops or individual apps on any device.,Trusted Vendor,Needs Verification,2026-03-04,assess,healthcare-pqc;migration-program;tls-basics;vpn-ssh-pqc,VND-127,ietf,
Apache Guacamole,CSC-036,Remote Access and VDI Software,"Security Stack, Network",No,"Apache Guacamole is an open-source clientless remote desktop gateway supporting VNC, RDP, and SSH over HTTPS. Guacamole uses TLS for the browser-to-gateway connection. PQC support depends on the underlying Java TLS stack (JSSE) and SSL termination layer (Nginx/Apache HTTPD). ML-KEM support will propagate from Java 22+ TLS improvements. No dedicated PQC release planned.",Open Source,Apache-2.0,1.5.5,2026-03-06 (Last Updated timestamp),No,Medium,Linux Docker,Enterprise Education Government,http://guacamole.apache.org/,https://github.com/apache/guacamole-server,A proxy daemon and software stack enabling efficient remote desktop access via a text-based protocol for JavaScript.,Open Source Foundation,Partially Verified,2026-03-25,assess,network-security-pqc;tls-basics;vpn-ssh-pqc,VND-046,microsoft,
PuTTY,CSC-014,SSH Implementation Software,"Security Stack, Application",Yes (ML-KEM hybrid KEX mlkem768x25519-sha256 + NTRU Prime),"Version 0.83 adds support for a second post-quantum key exchange algorithm, ML-KEM. The document does not specify the first PQC algorithm supported in previous versions or provide further implementation details beyond this addition.",Open Source,MIT,0.83,2025-02-08,No,High,"Windows, Unix",Enterprise Government Finance,https://www.chiark.greenend.org.uk/~sgtatham/putty/,https://git.tartarus.org/?p=simon/putty.git,"A free implementation of SSH and Telnet for Windows and Unix platforms, along with an xterm terminal emulator.",Open Source Community,Verified,2026-03-30,"assess,plan",migration-program;os-pqc;vpn-ssh-pqc,VND-228,ietf,
Paramiko (Python SSH),CSC-014,SSH Implementation Software,Security Stack,No,"Paramiko is the standard Python SSH implementation used by Ansible, Fabric, and countless automation scripts. Paramiko 3.x uses classical RSA/ECDSA/Ed25519 for host keys and Diffie-Hellman/ECDH for key exchange. No PQC support implemented or announced. PQC migration requires waiting for upstream SSH protocol PQC KEX standards and Paramiko implementation.",Open Source,LGPL-2.1,3.5.0,2026-03-05 (Last Updated date provided in metadata),No,High,Python environments; relies on `cryptography` library with precompiled options.,Technology DevOps Enterprise,https://github.com/paramiko/paramiko,https://github.com/paramiko/paramiko,Standard Python SSH library. Used by Ansible and automation tooling. No PQC support — millions of automation scripts depend on classical SSH.,Open Source Community,Partially Verified,2026-03-04,assess,crypto-dev-apis;os-pqc;vpn-ssh-pqc,VND-000,microsoft,
AsyncSSH,CSC-014,SSH Implementation Software,"Security Stack, Application",Partial (with scope),"Includes support for post-quantum key exchange algorithms ML-KEM and SNTRUP. This functionality is optional and requires manual installation of the liboqs library, as it is not a direct Python package installable via pip. No mention of PQC signature schemes or production deployment status.",Open Source,EPL-2.0 OR GPL-2.0-or-later,2.22.0,2026-03-06 (Last Updated date),No,Medium,Python 3.10+; UNIX systems; Windows,Technology DevOps,https://github.com/ronf/asyncssh,https://github.com/ronf/asyncssh,Python async SSH library with sntrup761 hybrid KEX support. More PQC-advanced than synchronous Paramiko. Used in modern async Python automation.,Open Source Community,Verified,2026-03-30,"test,migrate",crypto-dev-apis;os-pqc;vpn-ssh-pqc,VND-000,microsoft,
Microsoft Remote Desktop Services (RDS),CSC-036,Remote Access and VDI Software,"Security Stack, Cloud, Hardware, Application",No,Microsoft RDS provides Windows desktop and application delivery over RDP protocol. RDP 10.x uses TLS 1.3 for transport. PQC migration requires Windows Server RDP stack to support ML-KEM hybrid TLS and RDP protocol encryption upgrade. Microsoft has included RDS in its CNSA 2.0 migration roadmap targeting 2027. Windows Server 2025 Preview includes early PQC TLS work.,Commercial,Proprietary (Client Access Licenses mentioned),Windows Server 2025,2024-11,No,High,"Windows Server 2025, Windows Server 2022, Windows Server 2019, Windows Server 2016, Windows 11, Windows 10, Azure","Enterprise (implied by ""organization's needs"", ""Knowledge Worker"" scenarios)",https://learn.microsoft.com/en-us/windows-server/remote/remote-desktop-services/,,Platform delivering virtualized applications and secure remote/mobile desktop access through remote desktop sessions.,Trusted Vendor,Needs Verification,2026-03-04,assess,migration-program;tls-basics;vpn-ssh-pqc,VND-027,microsoft,
Snort IDS/IPS,CSC-018,Cryptographic Protocol Analyzers,"Security Stack, Network",No,"Snort is the original open-source intrusion detection system, now maintained by Cisco. Snort 3.x includes TLS inspector capabilities. PQC-relevant detection rules for hybrid ML-KEM cipher suites are discussed for Snort 3.2+ community ruleset but no evidence of shipped PQC-specific rules was found. Used in academic and enterprise networks for network-level cryptographic monitoring.",Open Source,NOASSERTION,3.0.0 (Build 250),2024-10,No,Medium,Cross platform support mentioned; Windows support is on the roadmap.,Government Defense Education Enterprise,https://github.com/snort3/snort3,https://github.com/snort3/snort3,Next generation Snort IPS (Intrusion Prevention System) with pluggable components and multi-threaded packet processing.,Open Source Community,Needs Verification,2026-03-30,assess,aerospace-pqc;arch-quantum-impact;migration-program;network-security-pqc;research-quantum-impact,VND-008,microsoft,pqc-detection-rules-unverified
Cisco ASA (Adaptive Security Appliance),CSC-033,Network Security Software,"Network, Hardware",No,"Cisco ASA 9.22 is a Quantum MidPoint Delivery milestone that supports RFC 8784_SKIP in ASDM, CLI, FDM, and FMC for IKEv2. ASA 9.24 targets Quantum Safe Delivery with RFC 9370 and ML-KEM 1024 for SSH. Current ASA 9.22 supports PQC pre-shared keys for IKEv2.",Commercial,"Proprietary (Implied by ""Commercial"" status and Cisco ownership; specific license text not stated)","9.24(x) (Cisco Secure Firewall ASA), 7.24(x) (ASDM)",2026-03-04,Yes (FIPS 140-2),Critical,"Cisco Secure Firewall ASA Series, Cisco ASA Device Package Software for ACI","Enterprise (Inferred from ""Cisco"" and general firewall context; specific industries not explicitly listed)",https://www.cisco.com/c/en/us/products/security/adaptive-security-appliance-asa-software/index.html,,Most deployed enterprise firewall. Cisco quantum-safe roadmap targets ML-KEM hybrid IKEv2 VPN for 2027 (CNSA 2.0). Critical migration dependency for enterprise perimeter security.,Trusted Vendor,Verified,2026-03-30,"assess,plan",aerospace-pqc;migration-program;network-security-pqc;vpn-ssh-pqc,VND-008,cisco-systems,
Cisco Meraki MX (Cloud-Managed Firewall),CSC-033,Network Security Software,"Network, Hardware, Cloud",No,Cisco Meraki MX is a cloud-managed next-generation firewall/SD-WAN platform used heavily in branch offices and SMB/enterprise deployments. AutoVPN uses IKEv2/IPsec with classical algorithms. Meraki cloud dashboard communications use TLS 1.3 (classical). New C8455-G2-MX hardware announced as AI/ML and PQC-ready. PQC follows Cisco's quantum-safe roadmap — no specific Meraki firmware PQC timeline published.,Commercial,"Proprietary (implied by ""Cisco Meraki"" and commercial trial/subscription model mentioned).",MX 18.x,2023-09-20 (Date of the Miercom evaluation report; product release date not stated).,No,High,"AWS, Azure, Alibaba Cloud, GCP, Cisco NFVIS (for vMX); On-premises hardware appliances.","Enterprise (Small branch to Data Center), SaaS application users.",https://meraki.cisco.com,,Enterprise security & SD-WAN appliance designed for distributed deployments requiring remote administration.,Trusted Vendor,Verified,2026-03-30,assess,ai-security-pqc;migration-program;network-security-pqc;vpn-ssh-pqc,VND-008,cisco-systems,
Fortinet FortiGate (FortiOS),CSC-033,Network Security Software,"Network, Security Stack, Hardware, Cloud",Yes (ML-KEM BIKE HQC Frodo IPsec PQC per FortiOS 7.6.x),Supports Quantum key distribution (QKD) requiring FortiOS 7.4.2 and Post Quantum Cryptography (PQC) for IPsec VPNs requiring FortiOS 7.6.1. Includes NIST-approved algorithms and algorithm stacking to protect against quantum computing threats.,Commercial,Proprietary,FortiOS 7.6.1,2025-01,Yes (FIPS 140-2),High,"Physical appliances (FortiGate 3800G Series), Virtualized environments, Cloud environments, Data Centers, Campus, Branch.","Enterprise, IT/OT, Manufacturing, Oil & Gas, Power Utilities, Health and Medical, Education, Financial Services, Retail, Hospitality, Service Providers.",https://www.fortinet.com/content/dam/fortinet/assets/solution-brief/sb-fortios-quantum-safe.pdf,,"Next-Generation Firewall protecting data, assets, and users across hybrid environments with AI-powered security.",Trusted Vendor,Verified,2026-03-30,"assess,plan",5g-security;healthcare-pqc;migration-program;network-security-pqc;vpn-ssh-pqc,VND-016,fortinet,
Arista EOS (Extensible Operating System),CSC-032,Network Operating Systems,Network,Planned,"Arista EOS powers Arista data center and campus switches/routers. EOS uses TLS 1.3 for management (eAPI, gNMI, gRPC) and BGP/OSPF routing protocols. PQC migration targets management plane TLS (ML-KEM) and BGPsec signing (ML-DSA). Arista has engaged in IETF PQC for BGP security working groups. No GA PQC release as of Q1 2026.",Commercial,Commercial (Arista Networks),4.33.0F,2025-01,No,High,Arista Hardware,Cloud Finance Telecom Enterprise,https://www.arista.com/en/products/eos,,Data center network OS. PQC targets management TLS (ML-KEM) and BGPsec signing (ML-DSA). Arista active in IETF PQC-BGP working groups.,Trusted Vendor,Needs Verification,2026-03-04,assess,5g-security;network-security-pqc,VND-003,cmvp,
MikroTik RouterOS,CSC-032,Network Operating Systems,"Network, Hardware, Cloud",No,"MikroTik RouterOS supports RFC 8784 PPK (Post-Quantum Preshared Keys) for IKEv2 including static and QKD-distributed pre-shared keys. Widely deployed network operating system for routers and switches, popular in ISPs and SMBs globally. ML-KEM native key exchange not yet available.",Commercial,Proprietary (requires license key from MikroTik Account server; free 24-hour trial available).,7.17,2025-01,No,Medium,"MikroTik hardware devices, PC (x86), Virtual Machines (Cloud Hosted Router/CHR), Amazon AWS marketplace.",ISP SMB Enterprise,https://mikrotik.com/software,,"Stand-alone operating system based on Linux kernel powering MikroTik hardware devices with routing, firewall, and VPN features.",Trusted Vendor,Verified,2026-03-30,assess,migration-program;network-security-pqc,VND-193,nist-csrc,
OpenWrt,CSC-031,Operating Systems,"Network, Hardware",No,"OpenWrt is an open-source Linux-based firmware for routers and embedded network devices. OpenWrt 23.05+ ships OpenSSL 3.x enabling PQC via liboqs-provider package. The WireGuard package (included by default) does not yet support PQC KEX. strongSwan package in OpenWrt provides experimental ML-KEM IPsec. Used in home, SMB, and research networks.",Open Source,GPL-2.0,24.10,2026-03-06,No,Medium,Embedded devices (Linux-based),SMB Research IoT,https://github.com/openwrt/openwrt,https://github.com/openwrt/openwrt,Open-source Linux router firmware. OpenSSL 3.x + liboqs-provider available. strongSwan provides experimental ML-KEM IPsec. Widely used in research and SMB networks.,Open Source Community,Verified,2026-03-30,"assess,test",crypto-dev-apis;network-security-pqc;os-pqc;secure-boot-pqc;tls-basics;vpn-ssh-pqc,VND-200,microsoft,
pfSense Community Edition,CSC-033,Network Security Software,"Network, Hardware",No,pfSense CE is an open-source firewall/router based on FreeBSD. IPsec VPN uses strongSwan with classical algorithms. PQC support would require FreeBSD strongSwan with ML-KEM enabled — currently not in pfSense base packages. Netgate (commercial maintainer) has not published a PQC roadmap for pfSense CE.,Open Source/Commercial,Apache-2.0,2.8.0,2026-03-06,No,Medium,FreeBSD operating system,SMB Education Government Research,https://pfsense.org/,https://github.com/pfsense/pfsense,Open-source FreeBSD firewall. No PQC support. Widely deployed in SMB and education. PQC requires FreeBSD strongSwan upgrade not yet in pfSense packages.,Open Source Community,Partially Verified,2026-03-25,assess,network-security-pqc,VND-195,microsoft,
OPNsense,CSC-033,Network Security Software,"Network, Security Stack",No,"OPNsense is an open-source FreeBSD-based firewall forked from pfSense. OPNsense 24.7.7+ added post-quantum SSH key exchange (mlkem768x25519-sha256 via OpenSSH 9.9). strongSwan IPsec ML-KEM support is still experimental in upstream strongSwan. Note: the implemented PQC is SSH key exchange, not IPsec.",Open Source,BSD-2-Clause,24.7,2026-03-06,No,Medium,"FreeBSD (implied by ""bsd"" topic and ""FreeBSD compatible package/ports origin"")",SMB Education Government Research,https://github.com/opnsense/core,https://github.com/opnsense/core,"Open source firewall project providing GUI, API, and systems backend for network security.",Open Source Community,Verified,2026-03-30,test,network-security-pqc;vpn-ssh-pqc,VND-194,microsoft,
NGINX Plus,CSC-038,Application Servers,"Application, Network, Cloud",Planned (with timeline),"NGINX Plus is the commercial version of the NGINX web server and load balancer, widely used for TLS termination. NGINX Plus R32+ (2024) supports OpenSSL 3.x which enables ML-KEM hybrid TLS when built with liboqs-provider. F5 (NGINX owner) has published PQC TLS guidance using NGINX Plus. Critical for TLS termination in enterprise application delivery.",Commercial,"Proprietary (Perpetual licensing (GBB), Subscriptions)",R33,2025-01,Yes (FIPS 140-3 via OpenSSL FIPS module),Critical,"Azure, Google Cloud Platform, Amazon Web Services, Kubernetes, Hardware, Software, SaaS","Banking and financial services, E-commerce, Healthcare, Public sector, Service provider",https://www.nginx.com/products/nginx/,,Commercial NGINX load balancer/TLS terminator. ML-KEM hybrid TLS via OpenSSL 3.x + liboqs-provider in R32+. Critical PQC migration point for enterprise TLS termination.,Trusted Vendor,Partially Verified,2026-03-04,"test,migrate",crypto-dev-apis;hybrid-crypto;migration-program;tls-basics;web-gateway-pqc,VND-014,fido-alliance,
